acto,secuencia,clip,tipo,encuadre,camara,accion,dialogo,dur_seg,acumulado
ACTO 2,12 — ESCENA: [AÑO 8] La resistencia / Marek / la encapuchada · *(104-108)*,105,ESTÁNDAR,warm medium on @Marek among his people.,slow push to his face.,"@Marek — warm-voiced, the kind people follow — speaks to a circle of worn, hungry naieli who hang on his hope.",,9,17:00
ACTO 2,12 — ESCENA: [AÑO 8] La resistencia / Marek / la encapuchada · *(104-108)*,105A,ACCIÓN·insert,montage of gaunt hopeful faces.,slow pushes across faces.,"the camera moves over gaunt, hopeful faces lit by lamplight — varied people, not all white-haired — clinging to @Marek's words.",,4,17:04
ACTO 2,12 — ESCENA: [AÑO 8] La resistencia / Marek / la encapuchada · *(104-108)*,106,EMOCIÓN,"medium, intercut with nodding faces.",steady.,"@Marek plants the doubt that holds them together; the people nod, given a different enemy.",,11,17:15
ACTO 2,12 — ESCENA: [AÑO 8] La resistencia / Marek / la encapuchada · *(104-108)*,107,ESTÁNDAR,medium on the hooded figure beside Marek.,slow push that never reveals the face.,"beside @Marek stands a silent @VeraEncapuchada — strong woman's hands, a strand of white hair escaping the hood — face unseen.",,9,17:24
ACTO 2,12 — ESCENA: [AÑO 8] La resistencia / Marek / la encapuchada · *(104-108)*,108,EMOCIÓN,close on the hood and hidden jaw.,"held, intimate, withholding.","the hooded figure watches @Marek and the people, then lowers her head — a private grief we can't read yet.",,11,17:35
ACTO 2,13 — ESCENA: La misión / la traición de Vosk / la captura · *(109-114)*,109,ESTABLISHING,wide establishing over the scrap dunes.,"slow sweep, the crew tiny among wrecks.","Theron's crew, @StellaPeloCorto now older and harder among them, picks through a vast graveyard of dead ships on a scrap world.",,12,17:47
ACTO 2,13 — ESCENA: La misión / la traición de Vosk / la captura · *(109-114)*,109A,ACCIÓN·insert,crew clambering through towering dead hulls.,"slow sweep, tiny against the scrap.","the crew clambers through towering dead hulls, salvaging, tiny against a sky of scrap, @StellaPeloCorto among them.",,4,17:51
ACTO 2,13 — ESCENA: La misión / la traición de Vosk / la captura · *(109-114)*,110,ACCIÓN,sudden wide as bounty hunters spring the trap.,fast whip into chaos.,local @CazadorRecompensas erupt from the wrecks in an ambush; the crew scatters into chaos and dust.,,7,17:58
ACTO 2,13 — ESCENA: La misión / la traición de Vosk / la captura · *(109-114)*,111,EMOCIÓN,she hides; cut to @Vosk seeing her across the field.,"tense, still, then a snap between their eyes.","@StellaPeloCorto presses into a crevice, safe and unseen — until @Vosk spots her from across the scrap; their eyes meet and hold.",,11,18:09
ACTO 2,13 — ESCENA: La misión / la traición de Vosk / la captura · *(109-114)*,112,ACCIÓN,insert of Vosk's hand taking a stone; he throws it.,snap to the clang beside her.,"@Vosk's hand closes on a rock; he hurls it to clang against the metal right beside her hiding spot — a deliberate, ugly tell.",,7,18:16
ACTO 2,13 — ESCENA: La misión / la traición de Vosk / la captura · *(109-114)*,113,ACCIÓN,"Vosk shouting, hunters converging.",whip to the swarm closing on her.,@Vosk points and bellows; @CazadorRecompensas swarm @StellaPeloCorto's position as she bursts up fighting.,,7,18:23
ACTO 2,13 — ESCENA: La misión / la traición de Vosk / la captura · *(109-114)*,114,EMOCIÓN,they clamp a collar on her; her suit dies; a net takes Vosk too.,"push to her face, then snap to Vosk netted.","the hunters clamp a @CollarControl on @StellaPeloCorto and her suit goes dark; the last thing she sees is @Vosk smirking — until a net drops over him too, his grin collapsing.",,11,18:34
ACTO 2,14 — ESCENA: La fosa / Noah / la negativa · *(115-120)*,115,ESTABLISHING,wide establishing of the pit and the mob.,crane down into the arena.,"the camera drops into a brutal betting-pit — cages, auction blocks, and a sunken arena ringed by a roaring crowd laying bets on blood.",,12,18:46
ACTO 2,14 — ESCENA: La fosa / Noah / la negativa · *(115-120)*,115A,ACCIÓN·insert,"bookies taking frantic bets, the mob baying.",quick whip-pans across the stands.,"bookies snatch frantic bets as the mob bays for blood, tokens flashing, faces lit by the pit-glare — the cruelty of the place laid bare.",,4,18:50
ACTO 2,14 — ESCENA: La fosa / Noah / la negativa · *(115-120)*,116,ESTÁNDAR,"@StellaPeloCorto alone in the pit, scanning for an exit.","slow orbit, the crowd a blur above.","a barker presents ""the Orb thief, the sector's most wanted""; the crowd roars; @StellaPeloCorto stands in the pit, collar on, eyes hunting for a way out that isn't there.",,9,18:59
ACTO 2,14 — ESCENA: La fosa / Noah / la negativa · *(115-120)*,117,ACCIÓN,the far gate opens; Noah shoved in.,"push to him, battered but unbowed.",the opposite gate grinds open and @Noah is shoved into the pit — a battered human with a worn light-blade and eyes that refuse to quit.,,7,19:06
ACTO 2,14 — ESCENA: La fosa / Noah / la negativa · *(115-120)*,118,INSERT,"close on her face, recognition.","slow push, the crowd dropping out of focus.","@StellaPeloCorto freezes — @Noah looks uncannily like her own people, an echo she can't place (the exiled descendants); the noise of the pit falls away for a beat.",,6,19:12
ACTO 2,14 — ESCENA: La fosa / Noah / la negativa · *(115-120)*,119,ACCIÓN,Noah raises his blade; she does not.,"steady standoff, crowd roaring for blood.","@Noah lifts his light-blade on guard; @StellaPeloCorto keeps her hands open and refuses, voice low and certain.",,7,19:19
ACTO 2,14 — ESCENA: La fosa / Noah / la negativa · *(115-120)*,119A,ACCIÓN·insert,fast exchange — his blade vs her evasions.,"circling whip-pans, motion blur of the crowd.","forced to move, @Noah swings and @StellaPeloCorto slips every strike without landing one of her own, the two reading each other mid-fight — challenge turning to respect in a single look.",,4,19:23
ACTO 2,14 — ESCENA: La fosa / Noah / la negativa · *(115-120)*,120,ACCIÓN,"quick two-shot, then a whip to the guards.",snap as they pivot together.,"a fast exchange of words, a shared decision — and instead of each other, @StellaPeloCorto and @Noah whirl on the pit guards.",,7,19:30
ACTO 2,15 — ESCENA: La fuga / salva a Vosk / el respeto de Theron · *(121-126)*,121,ACCIÓN,she rips the collar; the Orb reignites; back-to-back with Noah.,fast handheld through the breakout.,@StellaPeloCorto tears the @CollarControl off — the @Orbe blazes back to life in her hand — and she and @Noah fight back-to-back as the pit erupts into a breakout.,,7,19:37
ACTO 2,15 — ESCENA: La fuga / salva a Vosk / el respeto de Theron · *(121-126)*,121A,ACCIÓN·insert,wide as a burst of light throws back a wave of guards.,the blast shoves the camera back; impact frame.,"@StellaPeloCorto channels the @Orbe for the first time in a fight — a raw, uncontrolled burst of light flings a wave of guards off their feet; the recoil rocks her, and her own face flashes with shock at her power.",,4,19:41
ACTO 2,15 — ESCENA: La fuga / salva a Vosk / el respeto de Theron · *(121-126)*,122,ACCIÓN,the outer wall bursts inward; Brog leads.,"whip to the breach, dust and light.",the outer wall caves in as @Brog smashes through with @Nima behind — Theron sent for her; daylight and dust pour into the pit.,,7,19:48
ACTO 2,15 — ESCENA: La fuga / salva a Vosk / el respeto de Theron · *(121-126)*,122A,ACCIÓN·insert,"Brog wading through guards, Nima's gadgets.",fast handheld through the breach.,@Brog wades through pit-guards like a landslide while @Nima's four arms hurl improvised gadgets; the breach widens in dust and sparks.,,4,19:52
ACTO 2,15 — ESCENA: La fuga / salva a Vosk / el respeto de Theron · *(121-126)*,123,ESTÁNDAR,"@Vosk on his knees, an energy device at his neck.","push to his face, resigned.","on a platform above the chaos, the pit-owners kneel a used-up prisoner for execution — it is @Vosk, an energy device leveled at the back of his neck.",,9,20:01
ACTO 2,15 — ESCENA: La fuga / salva a Vosk / el respeto de Theron · *(121-126)*,124,ACCIÓN,she changes direction toward the platform; Noah yells to go.,fast tracking with her decision.,"@StellaPeloCorto sees @Vosk; @Noah screams for her to run for the breach — and she breaks the other way, sprinting straight for the man who sold her.",,7,20:08
ACTO 2,15 — ESCENA: La fuga / salva a Vosk / el respeto de Theron · *(121-126)*,124A,ACCIÓN·insert,she vaults off a guard and flips over the melee.,"fast tracking up the ramp, chaos blurring.","@StellaPeloCorto vaults off a guard's shoulder, flips over the melee and sprints up the execution ramp, the chaos blurring past — pure forward drive toward @Vosk.",,4,20:12
ACTO 2,15 — ESCENA: La fuga / salva a Vosk / el respeto de Theron · *(121-126)*,125,ACCIÓN,"she breaks the platform, deflects the device, hauls him up.",impact + push to Vosk's stunned face.,"@StellaPeloCorto smashes the platform, knocks the energy device aside and drags @Vosk to his feet; he stares at her, uncomprehending.",,7,20:19
ACTO 2,15 — ESCENA: La fuga / salva a Vosk / el respeto de Theron · *(121-126)*,125A,ACCIÓN·insert,primerísimo plano of Vosk's face mid-escape.,"tight, chaos blurred behind.","for one beat amid the running and the sparks, @Vosk's hard face cracks — something breaking and re-forming behind his eyes as respect is born.",,4,20:23
ACTO 2,15 — ESCENA: La fuga / salva a Vosk / el respeto de Theron · *(121-126)*,126,ESTÁNDAR,"the group escapes; later, Theron watching from afar.","running handheld, then a still wide on Theron.","they all break free as the station burns; later @Theron watches @StellaPeloCorto from a distance — the girl who saved her own betrayer — while @Noah can't take his eyes off her, and she never notices.",,9,20:32
ACTO 2,16 — ESCENA: Montaje · vínculos / idioma / traje / domar el Orbe · *(127-132)*,127,ESTABLISHING,wide lyrical establishing under the comet sky.,"slow drift, peaceful.","the camera drinks in a gentle alien world streaked with comets, the found family camped in its glow — the warmth that balances the dark.",,12,20:44
ACTO 2,16 — ESCENA: Montaje · vínculos / idioma / traje / domar el Orbe · *(127-132)*,127A,ACCIÓN·insert,quick warm montage beats.,gentle drifting cuts.,"quick warm beats — shared food, repairs by firelight, a rare laugh from @StellaPeloCorto, @Noah watching her — the found family knitting together under the comets.",,4,20:48
ACTO 2,16 — ESCENA: Montaje · vínculos / idioma / traje / domar el Orbe · *(127-132)*,128,ESTÁNDAR,intimate two-shot at the fire.,"slow, warm.",@Brog teaches @StellaPeloCorto words of his dead language by the fire; she repeats the ancient sounds and he gives the faint shift that is a mountain's smile.,,9,20:57
ACTO 2,16 — ESCENA: Montaje · vínculos / idioma / traje / domar el Orbe · *(127-132)*,129,ESTÁNDAR,Nima's four hands working the new suit.,"detail of the craft, then to Stella.","@Nima fits @StellaPeloCorto with a new suit, all four hands working at once, talking as she rivets.",,9,21:06
ACTO 2,16 — ESCENA: Montaje · vínculos / idioma / traje / domar el Orbe · *(127-132)*,129A,ACCIÓN·insert,she seals the new suit and stands.,"slow push, a transformation.","@StellaPeloCorto seals the @TrajeNuevo and stands; in the comet-light she looks older, harder — a transformation from refugee to soldier.",,4,21:10
ACTO 2,16 — ESCENA: Montaje · vínculos / idioma / traje / domar el Orbe · *(127-132)*,130,ACCIÓN,the Orb's light bucking out of control.,handheld kicked by each discharge.,"@StellaPeloCorto trains the @Orbe and it fights her — discharges throw her off her feet, blow panels apart; she gets up again, jaw set, frustrated and stubborn.",,7,21:17
ACTO 2,16 — ESCENA: Montaje · vínculos / idioma / traje / domar el Orbe · *(127-132)*,131,ESTÁNDAR,controlled light streaming from her open palm.,"slow awe, steadying with her.","at last @StellaPeloCorto channels it — light flows from her palm in a controlled ribbon, like a river that finally learns to run; her face: hard-won calm.",,9,21:26
ACTO 2,16 — ESCENA: Montaje · vínculos / idioma / traje / domar el Orbe · *(127-132)*,131A,ACCIÓN·insert,"wider shot, the ribbon of light arcing into the night.","slow awe, steady.","a ribbon of luzagua light arcs gracefully from @StellaPeloCorto's palm into the night, steady and bright; @Brog and @Nima watch, quietly amazed.",,4,21:30
ACTO 2,16 — ESCENA: Montaje · vínculos / idioma / traje / domar el Orbe · *(127-132)*,132,ESTÁNDAR,"primer plano of her face, the comet sky behind.","slow push, resolute.","@StellaPeloCorto in her new suit no longer looks like a survivor but like a weapon that chose its cause; she turns her eyes toward where Erdia lies, far across the dark.",,9,21:39
ACTO 2,17 — ESCENA: Theron pide la mano y el Orbe / la sospecha · *(133-136)*,132A,ACCIÓN·insert,"a brief wordless cut to a greyer, sicker Erdia.",slow mournful drift.,"a brief wordless cut to Erdia, greyer and sicker than before — fewer lights, more smoke — the 1:4 clock made flesh: she grows a little, her world dies a lot.",,4,21:43
ACTO 2,17 — ESCENA: Theron pide la mano y el Orbe / la sospecha · *(133-136)*,133,ESTÁNDAR,"close as she opens her palm, the Orb exposed.",slow push to the glow.,@Theron quietly asks; @StellaPeloCorto opens her hand and the @Orbe glows bare between them.,,9,21:52
ACTO 2,17 — ESCENA: Theron pide la mano y el Orbe / la sospecha · *(133-136)*,134,EMOCIÓN,his hand drifts toward the Orb; she holds her breath; he stops.,"tense micro push, then release.",@Theron's hand moves as if to tear it out; @StellaPeloCorto goes rigid — then he reads how it's woven into her blood and pulls back.,,11,22:03
ACTO 2,17 — ESCENA: Theron pide la mano y el Orbe / la sospecha · *(133-136)*,135,INSERT,close on Theron going very still.,slow push as something kindles behind his eyes.,@StellaPeloCorto describes her King; @Theron goes utterly still — it sounds like his prey — but says nothing.,,6,22:09
ACTO 2,17 — ESCENA: Theron pide la mano y el Orbe / la sospecha · *(133-136)*,136,ESTÁNDAR,"Theron alone, staring into the dark after she leaves.","slow push, brooding.","@Theron closes the subject, then stays staring into the void, a twenty-thousand-year suspicion stirring awake.",,9,22:18
ACTO 2,18 — ESCENA: La foto / la familia viva / Vera revelada · *(137-141)*,137,ESTÁNDAR,Theron sets a projector down; a cold image blooms.,push into the projector light.,@Theron sets a @Proyector on her table and tells her to look; a holographic image blooms in the dark.,,9,22:27
ACTO 2,18 — ESCENA: La foto / la familia viva / Vera revelada · *(137-141)*,138,ESTÁNDAR,"the projected image of Naio, old and chained.",slow push into the hologram.,"the projection shows @NaioEsclavo — Stella's father, aged, chained, a slave in a fog-mine.",,9,22:36
ACTO 2,18 — ESCENA: La foto / la familia viva / Vera revelada · *(137-141)*,139,ESTÁNDAR,"the projected image of Selka training, cold.","slow push, chilling.","the projection shows @SelkaGeneral — no longer a baby, a young soldier training with surgical cold, perfect and empty, the same grey-blue eyes as her mother.",,9,22:45
ACTO 2,18 — ESCENA: La foto / la familia viva / Vera revelada · *(137-141)*,139A,ACCIÓN·insert,the projection pushes in on Selka's cold face.,slow push into the hologram.,"the projection pushes in on @SelkaGeneral's cold, perfect face — a stranger now wearing the baby's features, grey-blue eyes empty.",,4,22:49
ACTO 2,18 — ESCENA: La foto / la familia viva / Vera revelada · *(137-141)*,140,ESTÁNDAR,the hooded leader's hood slips — Vera's face.,slow push to the reveal.,"in the projection a hooded leader directs the resistance; the hood slips for a second — it is @VeraEncapuchada's face, Vera, alive.",,9,22:58
ACTO 2,18 — ESCENA: La foto / la familia viva / Vera revelada · *(137-141)*,141,INSERT,primerísimo plano sostenido of her face.,"held, barely breathing.","@StellaPeloCorto's hand flies to her mouth, eyes spilling; @Theron watches her from the door like a man about to witness the impossible.",,6,23:04
ACTO 2,19 — ESCENA: [AÑO 14] Las minas / Naio / Vera se decide · *(142-145)*,142,ESTABLISHING,"wide of the misty mines, the hooded figure slipping through.",slow drift through fog.,"in the fog-mines of Year 14, @VeraEncapuchada slips between columns of slaves, searching face after face.",,12,23:16
ACTO 2,19 — ESCENA: [AÑO 14] Las minas / Naio / Vera se decide · *(142-145)*,143,ESTÁNDAR,she lowers her hood to an old broken man.,"intimate, trembling.","@VeraEncapuchada lowers her hood just enough; @NaioEsclavo stares, unable to believe it.",,9,23:25
ACTO 2,19 — ESCENA: [AÑO 14] Las minas / Naio / Vera se decide · *(142-145)*,144,ESTÁNDAR,"close two-shot, his plea.","steady, intimate.","@VeraEncapuchada tells him Selka is alive but changed; @NaioEsclavo grips her, begging her not to go.",,9,23:34
ACTO 2,19 — ESCENA: [AÑO 14] Las minas / Naio / Vera se decide · *(142-145)*,145,ESTÁNDAR,"she takes his face, then leaves into the fog.","push to her resolve, then she recedes; he reaches after.","@VeraEncapuchada cups @NaioEsclavo's face, decided, then turns and vanishes into the fog toward the palace as he reaches uselessly after her.",,9,23:43
ACTO 2,20 — ESCENA: Aposentos de la General / la muerte de Vera (el engaño) · *(146-154)*,146,ESTABLISHING,Vera enters; Korin/Lessa cover; Marek at the door.,"slow, tense.",@VeraEncapuchada slips in while @Korin and @Lessa cover the hall; @Marek stops her at the door with a hand on her shoulder.,,12,23:55
ACTO 2,20 — ESCENA: Aposentos de la General / la muerte de Vera (el engaño) · *(146-154)*,147,ESTÁNDAR,"Selka's back, Vera in the doorway.",slow push to Selka.,"inside, @SelkaGeneral stands with her back turned, knowing she is not alone.",,9,24:04
ACTO 2,20 — ESCENA: Aposentos de la General / la muerte de Vera (el engaño) · *(146-154)*,148,ESTÁNDAR,"Vera lowers her hood; Selka turns, a microsecond tremor.","push to Selka's face, the flicker crushed.","@VeraEncapuchada lowers her hood; @SelkaGeneral turns, sees her mother's face — something trembles for a microsecond before the training crushes it flat.",,9,24:13
ACTO 2,20 — ESCENA: Aposentos de la General / la muerte de Vera (el engaño) · *(146-154)*,149,ACCIÓN,Selka attacks; Vera only blocks and retreats.,kinetic but anguished handheld.,"@SelkaGeneral attacks in a flurry; @VeraEncapuchada only blocks, parries, gives ground — she cannot bring herself to strike her own daughter.",,7,24:20
ACTO 2,20 — ESCENA: Aposentos de la General / la muerte de Vera (el engaño) · *(146-154)*,149A,ACCIÓN·insert,detail of Vera absorbing blows on her forearms.,"anguished handheld, never striking back.","detail of the duel — @VeraEncapuchada absorbs strike after strike on her forearms, never once hitting back, her face pleading; a mother refusing to harm her child even to survive.",,4,24:24
ACTO 2,20 — ESCENA: Aposentos de la General / la muerte de Vera (el engaño) · *(146-154)*,150,ACCIÓN,"Selka's arm shaking, the blade lowering.",slow push to her cracking face.,"faced with someone who refuses to wound her, @SelkaGeneral falters; her arm trembles, the blade drops, something deep in her surrenders.",,7,24:31
ACTO 2,20 — ESCENA: Aposentos de la General / la muerte de Vera (el engaño) · *(146-154)*,151,EMOCIÓN,Vera folds her into an embrace.,"slow, tender, dread underneath.",@VeraEncapuchada pulls @SelkaGeneral into her arms and holds her the way mothers do.,,11,24:42
ACTO 2,20 — ESCENA: Aposentos de la General / la muerte de Vera (el engaño) · *(146-154)*,151A,ACCIÓN·insert,CU of Selka's face over Vera's shoulder.,slow push as a shutter slides down.,"CU of @SelkaGeneral's face over @VeraEncapuchada's shoulder in the embrace — confusion, a flicker of longing — then a cold blankness slides down like a shutter.",,4,24:46
ACTO 2,20 — ESCENA: Aposentos de la General / la muerte de Vera (el engaño) · *(146-154)*,152,ACCIÓN,"in the embrace, a light-blade drives in; Vera's glow dims.","tight, a single cruel beat. Death by light, no blood.","inside the embrace @SelkaGeneral drives a light-blade into @VeraEncapuchada's side; Vera gasps, her warm glow dimming out — no blood, only light leaving her.",,7,24:53
ACTO 2,20 — ESCENA: Aposentos de la General / la muerte de Vera (el engaño) · *(146-154)*,153,EMOCIÓN,primerísimo plano of Selka at Vera's ear.,"held, intimate, withholding the words.",@SelkaGeneral holds her mother close and whispers something at her ear we do not hear; @VeraEncapuchada's grey-blue eyes go wide.,,11,25:04
ACTO 2,20 — ESCENA: Aposentos de la General / la muerte de Vera (el engaño) · *(146-154)*,154,EMOCIÓN,"from the door, Korin/Lessa see only the killing; Vera dies on Selka's face.",slow pull from the doorway witnesses to Selka standing over the body.,"from the doorway @Korin and @Lessa see only the General killing her mother; @Marek arrives a second too late, stricken; @VeraEncapuchada dies with @SelkaGeneral's face as her last sight, believing it — and Selka, trembling over the body, begins to hum a lullaby she doesn't remember learning.",,11,25:15
ACTO 3,21 — ESCENA: [AÑO 20] El regreso · *(155-164)*,155,ESTABLISHING,wide establishing over the ruined city.,slow mournful crane over the grey.,"the camera glides over Erdia twenty years on — a grey, fractured city under fog, imperial murals looming above rubble where gardens used to be.",,12,25:27
ACTO 3,21 — ESCENA: [AÑO 20] El regreso · *(155-164)*,156,INSERT,"insert on Stella's name crossed out, hate-scrawl around it.",slow push to the defaced name.,"on a cracked wall, Stella's name is struck through and ringed with twenty years of scrawled hatred — the lie the King built.",,6,25:33
ACTO 3,21 — ESCENA: [AÑO 20] El regreso · *(155-164)*,157,ESTÁNDAR,the small ship lands; the team steps out.,"low, dust settling around their boots.","a small ship sets down among the scrap; @Brog, @Nima, @Noah and @StellaTeñida — hooded, dark-dyed hair — step out into the ruined city she once called home.",,9,25:42
ACTO 3,21 — ESCENA: [AÑO 20] El regreso · *(155-164)*,158,ESTÁNDAR,they move through hostile stares; an old man spits.,"handheld through the crowd, then close two-shot.",@StellaTeñida moves through the crowd under the hatred the King taught them — an old man spits at her name; @Noah leans in.,,9,25:51
ACTO 3,21 — ESCENA: [AÑO 20] El regreso · *(155-164)*,159,ESTÁNDAR,"resistance steps out, weapons up; Korin aims at Stella.","tense, weapons leveling.","a resistance group steps from the shadows, weapons raised; at the front an older @Korin levels his aim at the hooded @StellaTeñida.",,9,26:00
ACTO 3,21 — ESCENA: [AÑO 20] El regreso · *(155-164)*,160,ESTÁNDAR,she lowers the hood; he doesn't recognize the dark hair.,"slow push to his hardening face, about to give the order.","@StellaTeñida lowers her hood; @Korin, seeing only the dark-dyed hair, doesn't know her, his finger tightening to give the order.",,9,26:09
ACTO 3,21 — ESCENA: [AÑO 20] El regreso · *(155-164)*,161,EMOCIÓN,he studies her face; an old memory surfaces and breaks him.,slow push to his face as recognition dawns.,"then, under the dyed hair, @Korin recognizes her face — the little girl he knew twenty years ago, always at her mother's side; his aim drops, his voice cracking.",,11,26:20
ACTO 3,21 — ESCENA: [AÑO 20] El regreso · *(155-164)*,162,EMOCIÓN,faces of old loyalists realizing she's back.,slow drift across faces — hope and fear.,"word ripples through the old loyalists that Stella has returned — faces caught between hope and fear, twenty years of grief stirring.",,11,26:31
ACTO 3,21 — ESCENA: [AÑO 20] El regreso · *(155-164)*,163,ESTÁNDAR,"Vosk at the viewport, Theron behind.",slow push between them.,in orbit @Vosk watches Erdia churn and turns to @Theron; the hunter doesn't agree — but doesn't stop him.,,9,26:40
ACTO 3,21 — ESCENA: [AÑO 20] El regreso · *(155-164)*,164,ESTÁNDAR,"Theron alone, watching the planet, saying nothing.","slow push, brooding.","@Theron stares at Erdia and lets @Vosk go without a word, his own ancient suspicion pulling him toward the surface too.",,9,26:49
ACTO 3,22 — ESCENA: Stella visita a Naio · *(165-170)*,165,ESTÁNDAR,"Korin leads her to a bent, half-blind old man.",slow reveal of Naio.,"@Korin leads @StellaTeñida to a bent, half-blind old slave — @NaioRescatado, her father, unrecognizable under twenty years.",,9,26:58
ACTO 3,22 — ESCENA: Stella visita a Naio · *(165-170)*,166,ESTÁNDAR,she kneels; he can't find her face.,intimate two-shot.,@StellaTeñida sinks to her knees before him and says it; @NaioRescatado searches for a face he can't place.,,9,27:07
ACTO 3,22 — ESCENA: Stella visita a Naio · *(165-170)*,167,ESTÁNDAR,he takes her hand and feels the sigil glow.,"push to their joined hands, the @LlaveDeLuz pulsing.","@NaioRescatado takes her hand — and feels the @LlaveDeLuz pulsing beneath her skin, the @Orbe still safe; recognition floods him.",,9,27:16
ACTO 3,22 — ESCENA: Stella visita a Naio · *(165-170)*,168,EMOCIÓN,primerísimo plano sostenido of his good eye flooding.,"held, intimate.","@NaioRescatado's good eye floods; he cradles her face, twenty years collapsing into one moment.",,11,27:27
ACTO 3,22 — ESCENA: Stella visita a Naio · *(165-170)*,169,EMOCIÓN,"the embrace, held.","slow circle, warm.","father and daughter hold each other, twenty years of loss folding into a single trembling embrace.",,11,27:38
