acto,secuencia,clip,tipo,encuadre,camara,accion,dialogo,dur_seg,acumulado
ACTO 1,1 — ESCENA: Interior muerto del planeta + título,1,ESTABLISHING,"vast space-wide; the planet centered and small, scattered cold stars around it.","an almost imperceptible slow drift toward the world, as if the film is holding its breath.","the camera approaches the serene, beautiful world with reverence; cloud bands turn slowly, light creeps across the terminator line revealing rivers of gold, everything calm, sacred, and utterly alive — the world we are about to lose.",,12,0:12
ACTO 1,1 — ESCENA: Interior muerto del planeta + título,2,ESTÁNDAR,wide descending; the horizon-line of light splitting darkness from gold.,"the camera tips over the edge and falls toward the surface, plunging through luminous clouds.","the descent accelerates gently through cathedral-like clouds, light blooming and scattering around the lens, the world rushing up to meet us — beauty with the faint vertigo of a fall.",,9,0:21
ACTO 1,1 — ESCENA: Interior muerto del planeta + título,3,ESTÁNDAR,"low aerial gliding fast over the living land, then locking onto the dark fissure.",a sweeping forward glide that finds the scar and tilts down toward its mouth.,"the camera skims over forests and shining rivers full of life, then — like a thought intruding — drifts to the dry fissure and tips toward its dark throat, the warmth draining out of frame as it nears.",,9,0:30
ACTO 1,1 — ESCENA: Interior muerto del planeta + título,4,ESTÁNDAR,vertical descent between close rock walls.,"a slow, steady downward dolly into darkness.","the descent leaves the world of light behind, walls sliding upward past the lens, the warm thread of sky narrowing to nothing until only cold rock and shadow remain, deeper and deeper toward something wrong.",,9,0:39
ACTO 1,1 — ESCENA: Interior muerto del planeta + título,5,EMOCIÓN,"a wide reveal opening into the empty dead core, then a slow settle into total black.","the camera glides out into the void and stops, holding on nothing.",the cavern opens impossibly wide and utterly empty; the camera drifts into the void where a heartbeat should be and finds dead stillness; the frame sinks to pure black and holds. Title rises: STELLA FUGAZ.,,11,0:50
ACTO 1,2 — ESCENA: El parque de la luzagua (la utopía),6,ESTABLISHING,sweeping establishing wide over the utopian city.,a smooth high crane drifting over the glowing canals.,"the camera sails over the living city — citizens crossing bright bridges, light-water curling through the streets, gardens swaying — a whole civilization at peace, breathing in gold; the camera lets us fall in love with what is about to die.",,12,1:02
ACTO 1,2 — ESCENA: El parque de la luzagua (la utopía),7,ACCIÓN,tracking medium-wide following @StellaRopa as she runs.,"energetic lateral tracking alongside her, grass and light streaking past.","cutting from the dead black to blue sky and a peal of laughter, @StellaRopa sprints barefoot across the park, white braid snapping behind her, leaping a low rise, arms wide, pure unguarded joy in every stride as light and pollen scatter around her.",,7,1:09
ACTO 1,2 — ESCENA: El parque de la luzagua (la utopía),8,ESTÁNDAR,lyrical medium of hands cupping and releasing flowing light-water.,a slow loving glide along the river's surface.,"citizens dip their hands into the luzagua and let it run through their fingers, never closing their fists, the light streaming off their palms and rejoining the river — the world's quiet law shown without a word, beautiful and serene.",,9,1:18
ACTO 1,2 — ESCENA: El parque de la luzagua (la utopía),9,ACCIÓN,"medium on @StellaRopa's wrist and bright face, then a quick playful follow.",snap-follow as @Gix darts upward and away.,"@StellaRopa taps the @Brazalete on her wrist; with a soft chime @Gix blooms out of the air like a struck spark, spirals once around her head, then zips off between the trees — and she breaks into a laughing chase, swatting playfully at the light.",,7,1:25
ACTO 1,2 — ESCENA: El parque de la luzagua (la utopía),10,ESTÁNDAR,"medium on @VeraRopa walking calmly, @StellaRopa a bright blur in the distance.",a gentle dolly keeping pace with @VeraRopa.,"@VeraRopa strolls unhurried behind her daughter, fond and easy, watching the small running figure with a mother's quiet pride, and calls ahead with a teasing warmth.",,9,1:34
ACTO 1,2 — ESCENA: El parque de la luzagua (la utopía),11,ACCIÓN,"medium on @StellaRopa, half-turned over her shoulder mid-run.",a light handheld follow keeping her grinning face in frame.,"@StellaRopa runs backward a few steps, turning to flash a cocky, sweet grin at her mother, chin up with the easy arrogance of a kid who has never lost anything yet.",,7,1:41
ACTO 1,2 — ESCENA: El parque de la luzagua (la utopía),12,ESTÁNDAR,wide; a vast shadow sweeps across @StellaRopa as she stops.,a slow push as the shadow swallows her small figure.,"@StellaRopa skids to a stop as a huge shadow rolls over her; she lifts her gaze and the camera reveals the towering @MechaFlores — a war machine the size of a building, kneeling, its armor cracked open with flowers, petals drifting down from its shoulders like slow snow.",,9,1:50
ACTO 1,2 — ESCENA: El parque de la luzagua (la utopía),13,ESTÁNDAR,"low-angle wide (contrapicado), wide lens; @StellaRopa tiny in the lower frame, dwarfed by the giant overhead.","a slow tilt-up combined with a gentle push-in, scaling the machine.","@StellaRopa cranes her neck all the way back to take in the giant, mouth slightly open, a flower spiralling down past her face; small and curious beneath the sleeping war-machine, she asks aloud, almost to herself, the question of a generation born after the wars.",,9,1:59
ACTO 1,2 — ESCENA: El parque de la luzagua (la utopía),14,ESTÁNDAR,"tender two-shot, @VeraRopa crouching to @StellaRopa's height.",a slow push into an intimate medium of their faces.,"@VeraRopa kneels to her daughter's level, brushing a petal from Stella's hair, her smile fading into something honest and a little sad as she answers — the first time the girl hears the weight under the legend.",,9,2:08
ACTO 1,2 — ESCENA: El parque de la luzagua (la utopía),15,ESTÁNDAR,"medium two-shot; @VeraRopa gestures to the river, linking their faces to the flowing light.",a slow dolly that ties them to the moving water.,"@VeraRopa scoops a handful of luzagua and lets it stream back into the river, the light pouring off her fingers, as she gives Stella the one law of their people — gentle, deliberate, planting the seed that will decide everything.",,9,2:17
ACTO 1,2 — ESCENA: El parque de la luzagua (la utopía),16,EMOCIÓN,"medium that ends settling on @VeraRopa alone, watching her daughter go.",a slow drift to static on @VeraRopa's face.,"already chasing @Gix again, @StellaRopa waves and shouts over her shoulder as she runs off; @VeraRopa answers, then the camera lingers on her — a mother watching her child recede into the gold, a fond, faintly sad smile that we, and only we, know is the last of the good days.",,11,2:28
ACTO 1,3 — ESCENA: El laboratorio de Naio (la verdad y la huida),17,ESTABLISHING,"wide establishing of the lab interior, the holograms floating like cold ghosts.",a slow drift revealing the space and the rotating data.,"the camera glides through the silent laboratory, past slowly turning holographic readouts and pale instruments, the temperature of the whole film dropping — a place where something has already gone quietly, terribly wrong.",,12,2:40
ACTO 1,3 — ESCENA: El laboratorio de Naio (la verdad y la huida),18,ESTÁNDAR,medium on the door as @StellaRopa steps in.,a step-in follow as she crosses the threshold.,"the door breathes open and @StellaRopa strolls in still laughing, @Gix looping around her shoulders, the warmth of the park trailing in with her for one more second before the cold of the room reaches her.",,9,2:49
ACTO 1,3 — ESCENA: El laboratorio de Naio (la verdad y la huida),19,EMOCIÓN,over-shoulder from @StellaRopa to her grim parents.,a slow push as her smile drains away.,"@StellaRopa's grin fades by degrees as she reads the dread carved into @VeraArmadura and @Naio's faces; @Gix's glow dims and tucks behind her; the laughter dies in her throat, the room suddenly far too quiet.",,11,3:00
ACTO 1,3 — ESCENA: El laboratorio de Naio (la verdad y la huida),20,ACCIÓN,tight insert on the rotating hologram.,a slow push into the holographic image of the dead core.,"the projection turns slowly, replaying the plunge into the planet's black empty heart, data-glyphs and warning-reds crawling around the dead core — the unspeakable truth rendered in cold light.",,7,3:07
ACTO 1,3 — ESCENA: El laboratorio de Naio (la verdad y la huida),21,ESTÁNDAR,two-shot; @Naio presses a suit into her hands.,"steady, intimate.","@StellaArmadura takes the suit, confusion crossing her face, beginning to pull it on while searching her father's eyes for reassurance that doesn't come; @Naio's reply is clipped, urgent, gentle.",,9,3:16
ACTO 1,3 — ESCENA: El laboratorio de Naio (la verdad y la huida),22,ESTÁNDAR,"close two-shot, @Naio leaning in low.",a slow push to @Naio's half-shadowed face.,"@Naio lowers his voice almost to nothing, glancing toward the door, and speaks the forbidden thing aloud for the first time, every word costing him.",,9,3:25
ACTO 1,3 — ESCENA: El laboratorio de Naio (la verdad y la huida),23,EMOCIÓN,"medium, @Naio against the cold projection.",a subtle push tightening on his face.,"@Naio gestures to the dying planet behind him and lands the truth like a stone; @StellaArmadura's face crumbles into disbelief, her newly-sealed suit suddenly meaningless against words this big.",,11,3:36
ACTO 1,3 — ESCENA: El laboratorio de Naio (la verdad y la huida),24,ESTÁNDAR,shot-reverse between their faces.,"steady, cutting closer with each line.","@StellaArmadura protests, shaking her head, clinging to what she was taught; @Naio answers low and grim, the simple cruelty of it landing — the thing that gives life is exactly what the King means to steal.",,9,3:45
ACTO 1,3 — ESCENA: El laboratorio de Naio (la verdad y la huida),25,EMOCIÓN,tight on @StellaArmadura's open hand beneath the device.,a slow push to the hand as the light builds.,"@Naio guides @StellaArmadura's open hand under the device; petals of light fold inward and a glowing key-sigil burns itself into the skin of her palm; she sucks in a sharp breath and her fingers twitch, but she holds still, trusting him.",,11,3:56
ACTO 1,3 — ESCENA: El laboratorio de Naio (la verdad y la huida),26,EMOCIÓN,extreme close-up of the palm.,"a micro push, the sigil pulsing under the skin.","the @LlaveDeLuz pulses gently beneath @StellaArmadura's skin like a second small heart, light threading along faint veins — the quiet, fateful lock that the whole story will turn on, shown in a single held breath.",,11,4:07
ACTO 1,3 — ESCENA: El laboratorio de Naio (la verdad y la huida),27,EMOCIÓN,"close, @Naio folding her fingers shut over the sigil.","steady, intimate.","@Naio closes @StellaArmadura's fingers gently over the glowing mark and holds her fist in both of his, explaining the bond in a low, careful voice that makes it sound less like science and more like a vow.",,11,4:18
ACTO 1,3 — ESCENA: El laboratorio de Naio (la verdad y la huida),28,EMOCIÓN,close on @StellaArmadura's eyes as the weight lands.,a slow push to her face.,"@Naio holds her gaze without blinking, pressing the truth into her like a seal; @StellaArmadura's eyes widen as the size of it settles — she is not just carrying the Orb, she is the only one who can ever wield it.",,11,4:29
ACTO 1,3 — ESCENA: El laboratorio de Naio (la verdad y la huida),29,EMOCIÓN,medium; @StellaArmadura crosses to the cradle.,"a follow to the baby, the tension momentarily breaking.","@SelkaBebe stirs and breaks into a thin cry; without a thought @StellaArmadura abandons the gravity of the moment and goes straight to her little sister, the older-sister instinct overriding everything else in the room.",,11,4:40
ACTO 1,3 — ESCENA: El laboratorio de Naio (la verdad y la huida),30,EMOCIÓN,intimate close two-shot of the sisters' faces.,"a slow, gentle push.","@StellaArmadura cups her palm and a spark of @Gix drops into it, dancing like a captured firefly; she leans down and presses her forehead softly to the baby's, and both sisters smile — the crying stops. This exact gesture is the seed that detonates at the climax; render it clearly and warmly.",,11,4:51
ACTO 1,3 — ESCENA: El laboratorio de Naio (la verdad y la huida),31,EMOCIÓN,"sustained tender close-up, foreheads together, both smiling.","nearly still, barely breathing.","the camera holds — too long, on purpose — on the two sisters smiling forehead to forehead, the baby's small hand reaching for Stella's nose; the single image the entire film will ask us to remember.",,11,5:02
ACTO 1,3 — ESCENA: El laboratorio de Naio (la verdad y la huida),32,EMOCIÓN,medium; the parents' heads snap toward the door.,a sharp tension-push toward the door and the moving shadow.,"the warmth shatters as heavy approaching footsteps echo down the corridor; @Naio and @VeraArmadura exchange one fast, wordless look that says the time they were dreading has arrived.",,11,5:13
ACTO 1,3 — ESCENA: El laboratorio de Naio (la verdad y la huida),33,EMOCIÓN,"close family huddle, hands gripping faces and shoulders.","intimate, a slight nervous handheld.","@Naio takes @StellaArmadura's face in both hands, fierce and fast, pressing the command into her; the four of them fold into one brief, crushing embrace, @SelkaBebe pressed between them, before they break apart with the footsteps almost at the door.",,11,5:24
ACTO 1,3 — ESCENA: El laboratorio de Naio (la verdad y la huida),34,ESTÁNDAR,"wide low-angle on @Vorthan in the doorway, the robots as a dark mass behind.","a slow push to his calm, friendly smile.","the door opens and @Vorthan steps in with the easy warmth of a family friend dropping by, spreading his hands, the faceless @RobotImperial units filling the frame behind him — menace dressed as affection.",,9,5:33
ACTO 1,3 — ESCENA: El laboratorio de Naio (la verdad y la huida),35,ACCIÓN,"dynamic wide; @Naio steps between them, a shield flares, @Vorthan strikes him down.",a quick whip-pan and push as @StellaArmadura screams.,"@Naio throws himself forward and snaps up a crackling force-field to buy seconds; @Vorthan, almost gently, swats it apart and drops @Naio with a single pulse of energy (no blood, no wound); @StellaArmadura lunges with a scream as @VeraArmadura hauls her bodily toward the back exit.",,7,5:40
ACTO 1,4 — ESCENA: Pasillos del palacio (la huida),36,ACCIÓN,"tracking wide, the two running straight toward camera.",a fast Steadicam retreat ahead of them down the corridor.,"@VeraArmadura and @StellaArmadura sprint down the grand corridor, @SelkaBebe clutched tight to Vera's chest, banners and gilded arches flashing past in pulses of red, the low hum of robot drones swelling somewhere behind them.",,7,5:47
ACTO 1,4 — ESCENA: Pasillos del palacio (la huida),37,ESTÁNDAR,"running two-shot, profiles side by side.",lateral tracking locked to them.,"@VeraArmadura, breathless and fierce, turns her head to @StellaArmadura mid-stride and lays down the brutal law of the night — the Orb above all, above even the people running beside her — the words landing harder than the alarm.",,9,5:56
ACTO 1,4 — ESCENA: Pasillos del palacio (la huida),38,ACCIÓN,"close on @StellaArmadura's wet eyes, cutting to @VeraArmadura's impossible smile.",tight tracking on their faces.,"@StellaArmadura answers through brimming tears, jaw set; @VeraArmadura meets her with a smile that has no business existing in this moment — a mother's reassurance offered while sprinting for their lives.",,7,6:03
ACTO 1,4 — ESCENA: Pasillos del palacio (la huida),39,EMOCIÓN,"running two-shot, Vera pointing ahead.",tracking with urgency.,"@VeraArmadura flings out an arm toward a far junction as they run, shouting the escape plan over the rising alarm, her certainty the only thing holding the moment together.",,11,6:14
ACTO 1,4 — ESCENA: Pasillos del palacio (la huida),40,ACCIÓN,"dynamic wide; a wall explodes, robots flood in.",energetic handheld weaving through the fight.,"a wall blows inward and faceless @RobotImperial units swarm; @VeraArmadura fights one-armed with the baby pinned to her chest while @StellaArmadura ducks and strikes with quick agile bursts (energy and motion, no firearms), the two carving a desperate path forward through the chaos.",,7,6:21
ACTO 1,4 — ESCENA: Pasillos del palacio (la huida),40A,ACCIÓN·insert,dynamic action wide tracking her through the fight.,fast handheld + whip-pan following the redirect.,"@StellaArmadura flips over a lunging @RobotImperial, hooks its arm and redirects its strike into a second unit, then lands in a low crouch, white braid snapping — agile, lethal, fast.",,4,6:25
ACTO 1,4 — ESCENA: Pasillos del palacio (la huida),40B,ACCIÓN·insert,"medium tracking her advance, impact frames.",handheld punching in on each hit.,"@VeraArmadura, the baby clamped to her chest with one arm, drives an energy-charged palm into a robot's core; it folds; the corridor strobes red with each impact as she carves a path forward.",,4,6:29
ACTO 1,4 — ESCENA: Pasillos del palacio (la huida),41,ESTÁNDAR,wide; the two reach the towering doors.,a push toward the opening doors and the warm glow spilling out.,"@VeraArmadura and @StellaArmadura skid up to the colossal doors of the Orb chamber; the doors part with a deep resonant groan and a flood of warm sacred light pours over their faces — the goal, finally in reach.",,9,6:38
ACTO 1,5 — ESCENA: La sala del Orbe (la caída de Vera),42,ESTABLISHING,vast wide of the chamber and the floating Orb.,a slow reverent crane up and forward across the mirror-floor.,"the camera glides into the immense holy chamber, the mirrored floor doubling everything, and rises toward the @Orbe hanging weightless at the center — a sphere of liquid light slowly turning, exhaling rings of glow across the arches with each pulse, dwarfing the tiny figures entering below.",,12,6:50
ACTO 1,5 — ESCENA: La sala del Orbe (la caída de Vera),43,ESTÁNDAR,"wide as they burst in, the Orb framed ahead.",a push-in with them toward the sphere.,"@VeraArmadura and @StellaArmadura stumble through the great doors into the radiance, the @Orbe pulsing ahead of them like a second sun; for a breath the chaos behind is forgotten in the sheer presence of the thing they came to save.",,9,6:59
ACTO 1,5 — ESCENA: La sala del Orbe (la caída de Vera),44,EMOCIÓN,"wide symmetrical; the family at one side, @Vorthan entering opposite, the Orb suspended between.",a slow lateral move holding the standoff.,"across the immense floor, a far door opens and @Vorthan steps in at the very same moment, unhurried, hands folded; the two parties freeze, separated by the glowing Orb — one held, suspended breath before the race detonates.",,11,7:10
ACTO 1,5 — ESCENA: La sala del Orbe (la caída de Vera),45,EMOCIÓN,"symmetrical wide composition — @StellaArmadura centered, the @Orbe on one side, her mother on the other; the visual of her impossible choice (duty vs love).","held, balanced, almost motionless.","the staging itself tells it: @StellaArmadura stands dead center of the great hall, the @Orbe glowing to her left, @VeraArmadura to her right, her body torn between the duty her father gave her and the mother she loves — the thematic image of the entire film, held in perfect, terrible balance.",,11,7:21
ACTO 1,5 — ESCENA: La sala del Orbe (la caída de Vera),46,ACCIÓN,"@VeraArmadura shouting, snap to @StellaArmadura breaking into a sprint toward the Orb.",a snap-pan from @VeraArmadura to @StellaArmadura exploding into a run.,"@VeraArmadura screams the order and shoves Stella forward; @StellaArmadura bolts across the mirror-floor toward the @Orbe, the standoff shattering into desperate speed.",,7,7:28
ACTO 1,5 — ESCENA: La sala del Orbe (la caída de Vera),47,ACCIÓN,"dynamic medium; @VeraArmadura fighting one-armed, the baby shielded against her.",handheld locked to her struggle.,"@RobotImperial units converge on @VeraArmadura; she fights savagely with one arm while the other cradles @SelkaBebe, kicking and twisting to keep the baby clear, unable to follow her daughter across the hall.",,7,7:35
ACTO 1,5 — ESCENA: La sala del Orbe (la caída de Vera),47A,ACCIÓN·insert,"medium, she spins inside a ring of robots.","orbiting handheld, whip-pans to each threat.","surrounded, @VeraArmadura spins through the ring of @RobotImperial units — kicking, elbowing, the baby pressed tight; a unit clamps her arm and she wrenches free with a cry, never dropping @SelkaBebe.",,4,7:39
ACTO 1,5 — ESCENA: La sala del Orbe (la caída de Vera),47B,ACCIÓN·insert,"wide, she skids across the mirror-floor and rises.","camera drops with her, then snaps up as she plants.","an energy blast skids @VeraArmadura across the mirror-floor; she is already scrambling up, planting herself again between the machines and the baby's niche, teeth bared, refusing to stay down.",,4,7:43
ACTO 1,5 — ESCENA: La sala del Orbe (la caída de Vera),48,ACCIÓN,low menacing wide as @S1G1 strides in; cut to @VeraArmadura's dawning realization.,"a slow push to @S1G1's single glowing optic, then to @VeraArmadura's face.","the dark assassin @S1G1 walks in slow and silent where the other robots are loud, its one optic fixing on @VeraArmadura; her face changes as she understands — this is not a fight to win, it is an execution sent for her.",,7,7:50
ACTO 1,5 — ESCENA: La sala del Orbe (la caída de Vera),49,EMOCIÓN,"medium; @VeraArmadura tucks the baby into a safe niche, then turns and plants her stance.",a settle as she squares up.,"@VeraArmadura kisses @SelkaBebe's forehead and tucks her deep into a recessed panel, out of the line of danger, then rises and turns to face @S1G1 alone, planting her feet between the machine and her child.",,11,8:01
ACTO 1,5 — ESCENA: La sala del Orbe (la caída de Vera),50,ACCIÓN,"dynamic combat wide; @VeraArmadura gives everything, @S1G1 overpowers her.","kinetic handheld through the exchange, then a hard beat as she's struck down.","@VeraArmadura throws herself at @S1G1 with everything she has — strikes, a snatched weapon, raw desperation — but the machine is faster and stronger; with a single sweeping energy-wave it knocks her off her feet and she crashes to the mirror-floor, unhurt-looking but beaten.",,7,8:08
ACTO 1,5 — ESCENA: La sala del Orbe (la caída de Vera),50A,ACCIÓN·insert,"tight combat, her three strikes landing.",handheld pushing in with each blow.,"@VeraArmadura lands three blistering strikes on @S1G1, driving it back a full step — for one impossible beat she is winning; her face flares with ferocious hope.",,4,8:12
ACTO 1,5 — ESCENA: La sala del Orbe (la caída de Vera),50B,ACCIÓN·insert,"tight, S1G1 catches her wrist and flurries.",whip-pan + snap-zoom on the reversal.,"@S1G1 reads her, catches her wrist mid-swing and unleashes a blinding flurry; @VeraArmadura blocks on pure instinct, losing ground, her hope curdling into grim survival.",,4,8:16
ACTO 1,5 — ESCENA: La sala del Orbe (la caída de Vera),51,ESTÁNDAR,"low on @VeraArmadura fallen, reaching out, the baby's niche beyond.",a push to her face as she screams.,"sprawled on the floor, @VeraArmadura shoves herself up on one arm, flinging the other toward her daughter across the hall, and screams with everything left in her — the command and the goodbye fused into one word.",,9,8:25
ACTO 1,5 — ESCENA: La sala del Orbe (la caída de Vera),52,ACCIÓN,"@StellaArmadura three steps from the Orb, hand outstretched — then she turns back toward her mother.","a held beat on the reaching hand, then a whip as she reverses.","@StellaArmadura's fingers are a breath from the @Orbe, its light flooding her hand — and then she looks back, sees her mother down and her sister's niche, and turns away from the Orb entirely, sprinting back toward @VeraArmadura, breaking the one rule her father gave her for the love she can't override.",,7,8:32
ACTO 1,5 — ESCENA: La sala del Orbe (la caída de Vera),53,ACCIÓN,@Vorthan catches @StellaArmadura by her long braid and lifts her dangling.,"a push to his cruel calm, then down to her kicking feet.","@Vorthan's hand closes around @StellaArmadura's long white braid and hoists her off the floor, leaving her swinging and clawing at the air; he studies her struggle with serene, almost affectionate cruelty and speaks softly.",,7,8:39
ACTO 1,5 — ESCENA: La sala del Orbe (la caída de Vera),53A,ACCIÓN·insert,extreme insert + impact frame on the braid snapping taut.,"whip-pan as her head wrenches back, boots leaving the floor.","@Vorthan's fist snaps @StellaArmadura's braid taut; her head wrenches back, strands tearing loose, her boots lifting off the floor — a single brutal impact frame of helpless force.",,4,8:43
ACTO 1,5 — ESCENA: La sala del Orbe (la caída de Vera),54,ACCIÓN,"tight close-up of @StellaArmadura's face, hung by the hair, tears flying, unable to break free.",a slow push into her anguish.,"held tight on @StellaArmadura's face — teeth bared, tears torn loose and floating in the charged air, hands wrenching uselessly at the braid that holds her — pure rage and helplessness as she's forced to watch what comes next.",,7,8:50
