acto,secuencia,clip,tipo,encuadre,camara,accion,dialogo,dur_seg,acumulado
ACTO 1,5 — ESCENA: La sala del Orbe (la caída de Vera),55,ACCIÓN,"wide catching @VeraArmadura's raised hands and the shield around @StellaArmadura, with @S1G1's light-lance descending behind @VeraArmadura; cut to Stella's scream.","a wide that holds the shield and the killing light, then a snap to Stella. Death shown as her vital glow extinguishing — no blood, no wound.","from the floor @VeraArmadura throws her hands up and a warm shield of light wraps protectively around @StellaArmadura; in the same instant, behind her, @S1G1 lowers a lance of light and a single flash passes through @VeraArmadura — her glow goes out like a snuffed flame, no blood, only light leaving her — and @StellaArmadura's scream tears across the hall.",,7,8:57
ACTO 1,5 — ESCENA: La sala del Orbe (la caída de Vera),56,ACCIÓN,fractured intercutting — @VeraArmadura's fading face mouthing a word / @StellaArmadura severing her braid with the light-blade.,"tight intercut, the two actions braided together.","@VeraArmadura, the last of her light guttering out, shapes the word ""Run"" with no breath behind it; above, @StellaArmadura drags the @CuchilloLaser to the nape of her neck and a clean line of white light parts her white braid in a single stroke — the severed plait drifts away as she drops free and the protective shield dies with the last of @VeraArmadura's glow. No blood — only light leaving a body.",,7,9:04
ACTO 1,6 — ESCENA: Toma el Orbe / huida por el ducto,57,ACCIÓN,"tracking @StellaPeloCorto sprinting to the Orb, ducking a robot.",a fast follow weaving with her.,"broken and tear-streaked but moving on instinct, @StellaPeloCorto sprints back across the mirror-floor toward the @Orbe, sliding under a @RobotImperial's grab and scrambling up without breaking stride, eyes locked on the sphere.",,7,9:11
ACTO 1,6 — ESCENA: Toma el Orbe / huida por el ducto,58,EMOCIÓN,"close on her hand closing around the Orb, the palm-key igniting.",a push as the Orb shrinks and pours into her hand.,"@StellaPeloCorto's hand closes around the @Orbe; the @LlaveDeLuz blazes awake in her palm and the great sphere collapses inward, streaming as liquid light into her hand until it pulses there beneath her skin — power and grief sealed together in one stroke.",,11,9:22
ACTO 1,6 — ESCENA: Toma el Orbe / huida por el ducto,59,ACCIÓN,"extreme close-up of the wrist monitor's bar filling to ""MAX"".",a micro push on the readout.,"on @StellaPeloCorto's wrist the @MonitorMAX charge-bar floods from empty to full in a rush of light and locks at MAX, the readout pulsing — the clock that will return at the very end of the film, planted here in a single insert.",,7,9:29
ACTO 1,6 — ESCENA: Toma el Orbe / huida por el ducto,60,ACCIÓN,"low wide; thrusters fire, @StellaPeloCorto launches upward toward the ceiling duct.",a fast tilt-up following her launch into the heights.,"@StellaPeloCorto's suit-thrusters ignite with a roar and she rockets straight up off the floor, threading toward a narrow duct high in the ceiling haze, the great chamber falling away beneath her boots.",,7,9:36
ACTO 1,6 — ESCENA: Toma el Orbe / huida por el ducto,60A,ACCIÓN·insert,vertiginous vertical wide following her launch.,"fast tilt-up, the chamber falling away.","@StellaPeloCorto rockets straight up past the cathedral arches, debris and pollen streaking past the lens, the vast chamber shrinking dizzyingly beneath her boots.",,4,9:40
ACTO 1,6 — ESCENA: Toma el Orbe / huida por el ducto,61,ACCIÓN,"@StellaPeloCorto's POV downward — her fallen mother and the crying baby, tiny and far below.","a held beat, the image burning in before she tears away.","for one suspended second @StellaPeloCorto looks down through the rising air at the small, still shape of her mother on the mirror-floor and the crying baby in the alcove — the last look, the image that will hollow her out for twenty years — then she wrenches her gaze away and dives into the duct.",,7,9:47
ACTO 1,6 — ESCENA: Toma el Orbe / huida por el ducto,62,ACCIÓN,claustrophobic; @S1G1 thrusting up the duct inches from her boots.,a fast forward track through the cramped tunnel.,"@StellaPeloCorto streaks up the narrow duct on her thrusters, walls a blur inches from her shoulders; below and behind, @S1G1's optic burns as it rockets after her, closing the gap until its claw scrapes the air just beneath her boots.",,7,9:54
ACTO 1,6 — ESCENA: Toma el Orbe / huida por el ducto,62A,ACCIÓN·insert,claustrophobic; the claw raking sparks by her boot.,snap-zoom to her face mid-scream.,"@S1G1's claw rakes a shower of sparks off the duct wall a hair from @StellaPeloCorto's boot; snap-zoom to her face mid-scream, the sound swallowed by the thruster roar.",,4,9:58
ACTO 1,6 — ESCENA: Toma el Orbe / huida por el ducto,62B,ACCIÓN·insert,first-person urgency as the duct narrows.,"fast forward-track, walls squeezing in.","the duct narrows hard ahead; @StellaPeloCorto tucks her arms and shoulders tight, metal shrieking inches past her, the strobing light quickening as the tube squeezes down.",,4,10:02
ACTO 1,6 — ESCENA: Toma el Orbe / huida por el ducto,63,ACCIÓN,@S1G1 jams in the narrow opening; sparks; a clean blast hurls @StellaPeloCorto out into daylight.,burst out of the dark tube into bright sky with her.,"@StellaPeloCorto shoots out of the duct mouth into open sky; right behind her @S1G1's larger frame wedges hard in the narrowing opening, throws sparks, and detonates in a clean burst of light and smoke, the shockwave flinging @StellaPeloCorto clear and tumbling into the air.",,7,10:09
ACTO 1,6 — ESCENA: Toma el Orbe / huida por el ducto,63A,ACCIÓN·insert,"tight detail on the wedging frame, optic flaring.","slow push amid fast chaos, then sparks.","@S1G1's bulk wedges in the throat of the duct, joints buckling, its single optic flaring red as it strains after her — sparks crawling up its frame an instant before it goes.",,4,10:13
ACTO 1,6 — ESCENA: Toma el Orbe / huida por el ducto,64,ESTÁNDAR,@Vorthan lifts the baby from the alcove; robots move toward @VeraArmadura's body.,"slow, cold, deliberate.","@Vorthan crosses the great floor and lifts @SelkaBebe gently from her niche; the baby quiets in his arms, grey-blue eyes wide; behind him @RobotImperial units stoop toward @VeraArmadura's still form.",,9,10:22
ACTO 1,6 — ESCENA: Toma el Orbe / huida por el ducto,65,ESTÁNDAR,"@Vorthan halts the robots with a gesture, turns away with the baby, leaving @VeraArmadura behind.","a slow pull-back, leaving @VeraArmadura tiny and alone in the great room.","@Vorthan raises a single hand and the robots freeze over @VeraArmadura's body; without a flicker of feeling he turns and walks out with the baby, his flat order echoing as the camera pulls back to leave @VeraArmadura alone on the immense floor.",,9,10:31
ACTO 1,7 — ESCENA: Persecución en el cielo / el sacrificio,66,ACCIÓN,@StellaPeloCorto drops onto @VeraArmadura's hidden ship; trembling hands at the controls.,"tight in the small cockpit, then a jolt of ignition.","@StellaPeloCorto crashes down onto @NaveStella, scrambles into the cockpit and slaps at the controls with shaking, fumbling hands, sobbing once before the engines catch and the canopy seals — survival on raw autopilot.",,7,10:38
ACTO 1,7 — ESCENA: Persecución en el cielo / el sacrificio,66A,ACCIÓN·insert,"wide, energy-fire raining as the ship lurches off.","handheld shake, the nook erupting behind.",imperial energy-fire rains on the terrace; @StellaPeloCorto's engines catch and @NaveStella lurches off the landing nook just as it erupts behind her in a clean burst of light.,,4,10:42
ACTO 1,7 — ESCENA: Persecución en el cielo / el sacrificio,67,ACCIÓN,wide; @NaveStella lifts off as the @NaveImperial fleet rises on the horizon.,"rise with the ship, fleet looming beyond.","@NaveStella tears up off the terrace into the open sky; ahead, across the golden horizon, a wall of cold @NaveImperial warships resolves out of the haze and turns toward her — the chase beginning.",,7,10:49
ACTO 1,7 — ESCENA: Persecución en el cielo / el sacrificio,68,ESTABLISHING,"vast wide; the armada filling the frame, one small ship beneath it.",a slow reveal pulling out to show the impossible odds.,"the camera widens to reveal the true scale — an armada of @NaveImperial ships blackening the sky, and beneath them @NaveStella a single glinting speck, hopelessly outnumbered.",,12,11:01
ACTO 1,7 — ESCENA: Persecución en el cielo / el sacrificio,69,ACCIÓN,kinetic chase weaving between towers; pursuers clipping and crashing.,a fast follow banking hard with the ship.,"@StellaPeloCorto flies like she was born to it, threading @NaveStella between honey-stone towers and under glowing bridges, juking so tight that two heavier @NaveImperial pursuers misjudge the gaps and slam into the architecture in clean bursts of light — but more keep coming.",,7,11:08
ACTO 1,7 — ESCENA: Persecución en el cielo / el sacrificio,69A,ACCIÓN·insert,"chase wide, threading a closing gap, inverted.","camera bolted to the hull, banking hard.","@StellaPeloCorto threads @NaveStella through a closing gap between two bridges, inverted, the hull scraping sparks; her hands a blur on the controls, eyes ice-cold.",,4,11:12
ACTO 1,7 — ESCENA: Persecución en el cielo / el sacrificio,69B,ACCIÓN·insert,over-shoulder as a pursuer clips a tower behind her.,whip-pan to the cartwheeling crash.,"an @NaveImperial ship misjudges the gap behind her, clips a honey-stone tower and cartwheels into a blooming fireball of clean light; debris rains past her canopy.",,4,11:16
ACTO 1,7 — ESCENA: Persecución en el cielo / el sacrificio,70,ACCIÓN,an @NaveImperial ship frames @NaveStella; an energy beam charges.,a tense tighten as the weapon builds.,"a heavy imperial ship slides in behind @NaveStella and locks her dead-center in its sights; its energy-cannon spools up with a rising whine, light gathering at the muzzle, the shot a heartbeat from firing.",,7,11:23
ACTO 1,7 — ESCENA: Persecución en el cielo / el sacrificio,70A,ACCIÓN·insert,"tight, she barrel-rolls off the lock at the last instant.",whip-roll with the ship as the beam sears past.,"at the last instant @StellaPeloCorto barrel-rolls @NaveStella off the targeting lock; the energy beam sears past exactly where she was, close enough to wash the cockpit white.",,4,11:27
ACTO 1,7 — ESCENA: Persecución en el cielo / el sacrificio,71,ACCIÓN,"the pursuing ship explodes; @NaveAliada ships swoop in firing energy beams, carving a corridor.","a whip to the rescue, energetic and sweeping.","the @NaveImperial ship behind her erupts in a clean burst as a flight of @NaveAliada craft drops out of the sun, lancing energy-fire across the armada and tearing open a corridor of clear sky for @NaveStella to dive through.",,7,11:34
ACTO 1,7 — ESCENA: Persecución en el cielo / el sacrificio,71A,ACCIÓN·insert,through-canopy as an allied ship slides into the beam.,push to her eyes catching the sacrifice.,an @NaveAliada ship slides deliberately into the beam meant for @StellaPeloCorto and blooms into light; through the canopy her eyes catch the pilot's silhouette an instant before it is gone.,,4,11:38
ACTO 1,7 — ESCENA: Persecución en el cielo / el sacrificio,72,INSERT,close on @Piloto1's resolute face in her cockpit.,"steady, intimate, holding her gaze.","inside an @NaveAliada cockpit, @Piloto1 — steady, already at peace with how this ends — keys her comm and watches the battle through her canopy, fear nowhere on her face.",,6,11:44
ACTO 1,7 — ESCENA: Persecución en el cielo / el sacrificio,73,ESTÁNDAR,intercut @NaveAliada ships shielding her / @StellaPeloCorto listening in her cockpit.,"steady on the radio voice, cutting to Stella's wet eyes.","@Piloto1's voice comes over @StellaPeloCorto's radio, calm and final, as @NaveAliada ships slide deliberately into the line of fire to cover her; @StellaPeloCorto stares at the comm, understanding what they are choosing to do for her.",,9,11:53
ACTO 1,7 — ESCENA: Persecución en el cielo / el sacrificio,74,ACCIÓN,"close on @StellaPeloCorto crying in the cockpit, cut to the allied charge.","tight on her face, then a whip to the sacrifice outside.","@StellaPeloCorto shakes her head, crying out at the comm in protest, hands white on the controls; the radio voice answers with a last, gentle instruction as the @NaveAliada ships dive into the armada to hold the corridor open.",,7,12:00
ACTO 1,7 — ESCENA: Persecución en el cielo / el sacrificio,75,ACCIÓN,@NaveAliada ships interpose and burst one by one; @StellaPeloCorto watches them die for her as she breaks for open space.,"her POV through the canopy at the sacrifice, then an acceleration away.","one by one the @NaveAliada ships throw themselves into the armada and bloom into clean bursts of light, each death buying her a few more seconds; @StellaPeloCorto watches through the canopy, tears running, then hauls @NaveStella around and accelerates into the open dark, alone with everyone's sacrifice on her shoulders.",,7,12:07
ACTO 1,8 — ESCENA: Sin oxígeno / híper salto,75A,ACCIÓN·insert,her path crossed by a burning allied ship shielding her.,"handheld of fugue, the wingmate spinning across frame.","@Piloto2's burning @NaveAliada spins across @StellaPeloCorto's path, shielding her for the final seconds, before it too bursts into clean light; @StellaPeloCorto's face breaks as she punches for open space.",,4,12:11
ACTO 1,8 — ESCENA: Sin oxígeno / híper salto,76,ESTÁNDAR,"wide; the small ship adrift, the planet receding into the dark.","a slow drift, vast and quiet.","the roar of battle drops to absolute silence; @NaveStella coasts alone through the void while @Erdia dwindles behind it, golden and faintly sick, the whole world she lost shrinking to a point of light.",,9,12:20
ACTO 1,8 — ESCENA: Sin oxígeno / híper salto,77,ACCIÓN,close on @StellaPeloCorto as a soft alarm pulses.,a slow push to her slowing breath.,"a soft alarm begins to pulse — oxygen critical — and @StellaPeloCorto's breathing slows and shallows; she sits limp in the harness, tears sliding sideways, too hollowed-out to fight, the red light washing over her in time with her fading breaths.",,7,12:27
ACTO 1,8 — ESCENA: Sin oxígeno / híper salto,78,INSERT,extreme close-up on @StellaPeloCorto's eyes losing focus.,a micro push with a soft rack into blur.,"extreme close on @StellaPeloCorto's grey-amber eyes as they drift and unfocus, lids growing heavy, the world sliding out of focus around the edges as she begins to black out.",,6,12:33
ACTO 1,8 — ESCENA: Sin oxígeno / híper salto,79,ESTÁNDAR,"she looks at her glowing palm, then presses it flat to the console.",from her hand to the console flooding with light.,"half-conscious, @StellaPeloCorto lifts her hand and stares at the @LlaveDeLuz and the @Orbe glowing beneath her skin, then presses her open palm to the console in pure desperation; light floods out of her hand into the ship, panels igniting one after another.",,9,12:42
ACTO 1,8 — ESCENA: Sin oxígeno / híper salto,80,ACCIÓN,"energy floods the ship, everything overloads, then a blinding white hyperjump swallows the frame.",a rush forward into a white bloom.,"the borrowed light overloads every system; @NaveStella shudders violently, seams blazing, and then snaps forward into a hyperjump — a blinding white flash tears the ship out of its universe and swallows the entire frame in white.",,7,12:49
ACTO 1,"9 — ESCENA: El discurso de Vorthan (Erdia, Año 0)",81,ESTABLISHING,huge establishing wide over the gathered people toward the balcony.,a slow crane over the sea of heads toward the distant King.,"the camera sails over a vast ocean of gathered citizens filling the plaza beneath banners and a blue sky, all faces turned up toward the small distant figure on the high balcony — a whole people about to be told who to hate.",,12,13:01
ACTO 1,"9 — ESCENA: El discurso de Vorthan (Erdia, Año 0)",82,EMOCIÓN,"strong medium of @Vorthan addressing the crowd, mournful and perfect.","a slow push to his composed, sorrowful face.","@Vorthan stands at the balcony's edge and lets a long, practiced silence hang before he speaks, his face a mask of shared grief, every gesture calculated to look like a man carrying his people's pain.",,11,13:12
ACTO 1,"9 — ESCENA: El discurso de Vorthan (Erdia, Año 0)",83,EMOCIÓN,"medium on @Vorthan, intercut with the horrified crowd.","steady on him, then cutting down to the faces.","@Vorthan names the loss with grave tenderness; the camera cuts to the crowd as a wave of gasps and grief ripples backward through the plaza, hands to mouths, the lie taking root.",,11,13:23
ACTO 1,"9 — ESCENA: El discurso de Vorthan (Erdia, Año 0)",84,EMOCIÓN,medium on @Vorthan delivering the prophecy.,a slow push.,"@Vorthan spreads his hands and foretells the planet's slow death, each phrase weighted to spread fear, the crowd below going silent and stricken beneath him.",,11,13:34
ACTO 1,"9 — ESCENA: El discurso de Vorthan (Erdia, Año 0)",85,ESTÁNDAR,"wide revealing the caged, beaten allies behind/below him.",a slow lateral move past the cages.,"the camera drifts across rows of cages flanking the balcony where the allies who saved @StellaPeloCorto stand captured and defeated, displayed to the crowd as proof — beaten but unbloodied — while @Vorthan gestures to them as traitors.",,9,13:43
ACTO 1,"9 — ESCENA: El discurso de Vorthan (Erdia, Año 0)",86,EMOCIÓN,a montage of faces in the crowd shifting from grief to rage in real time.,quick pushes across individual faces.,"the camera moves through the crowd catching faces mid-transformation — grief tightening into anger, tears drying into snarls, fists clenching — a people's love curdling into hatred before our eyes.",,11,13:54
ACTO 1,"9 — ESCENA: El discurso de Vorthan (Erdia, Año 0)",87,INSERT,strong close on @Vorthan delivering the name like a sentence.,"a push to his calm, cruel face.","@Vorthan lets the silence build, then hands the crowd their enemy — the name landing like a verdict, his sorrow never slipping even as the plaza erupts in fury beneath him.",,6,14:00
ACTO 1,"9 — ESCENA: El discurso de Vorthan (Erdia, Año 0)",88,EMOCIÓN,"@Vorthan holds @SelkaBebe before the crowd and, almost imperceptibly, strokes her head like a father; then to black.","a slow push to the tender-yet-wrong gesture, then a fade to black.","above the roaring crowd, @Vorthan lifts @SelkaBebe so all can see her, and — almost too small to notice — gently strokes her white hair like a doting father, the baby's grey-blue eyes blinking up at him; the image holds, intimate and deeply wrong, then cuts to black. END OF ACT 1.",,11,14:11
ACTO 2,"10 — ESCENA: La nave nodriza / ""te recogí"" · *(89-95)*",89,ESTABLISHING,wide establishing of the cavernous bay.,slow drift through the gloom toward the wreck.,"the camera glides through the immense, silent bay, revealing @NaveStella broken and held in the claws of something far older and bigger than anything on Erdia.",,12,14:23
ACTO 2,"10 — ESCENA: La nave nodriza / ""te recogí"" · *(89-95)*",90,INSERT,"close on @StellaPeloCorto waking, disoriented.",a slow push as she checks her hand first.,"@StellaPeloCorto jolts awake on the metal floor; before anything else her eyes snap to her palm — the @LlaveDeLuz still glows, the @Orbe still inside — and a flicker of relief crosses her exhausted face.",,6,14:29
ACTO 2,"10 — ESCENA: La nave nodriza / ""te recogí"" · *(89-95)*",90A,ACCIÓN·insert,primerísimo plano on her face.,slow push as grief crashes in.,"as she registers where she is, the grief of the escape crashes back over @StellaPeloCorto — her mother, the allies — her face crumpling before she forces it flat, utterly alone in a strange universe.",,4,14:33
ACTO 2,"10 — ESCENA: La nave nodriza / ""te recogí"" · *(89-95)*",91,ESTÁNDAR,a huge shadow resolves into @Theron.,slow push to his unblinking eyes.,"a vast shadow shifts in the gloom and @Theron steps forward — tall, of another species, eyes that never blink, centuries worn into his face; @StellaPeloCorto scrambles back on guard.",,9,14:42
ACTO 2,"10 — ESCENA: La nave nodriza / ""te recogí"" · *(89-95)*",92,ESTÁNDAR,shot-reverse between them.,"steady, cold.","@StellaPeloCorto, broken-voiced, asks if he saved her; @Theron answers without warmth.",,9,14:51
ACTO 2,"10 — ESCENA: La nave nodriza / ""te recogí"" · *(89-95)*",93,INSERT,close on Theron eyeing the glow in her hand.,slow push to the Orb's light under her skin.,"@Theron's gaze locks onto the light pulsing in her palm as he speaks, reading her like a trail rather than a person.",,6,14:57
ACTO 2,"10 — ESCENA: La nave nodriza / ""te recogí"" · *(89-95)*",94,INSERT,primerísimo plano of her face and fist.,micro push as she closes her hand.,"@StellaPeloCorto closes her fist over the light and hides it against her chest, a new fear dawning — to him she is not a rescued child but bait.",,6,15:03
ACTO 2,11 — ESCENA: Maltrato / Vosk / Brog y Nima / la dilatación · *(96-106)*,95,ESTABLISHING,"wide of the hold, crew turning to look.",slow track past hostile faces.,@StellaPeloCorto moves through the grimy hold under the cold stares of a mismatched alien crew who clearly think she does not belong aboard.,,12,15:15
ACTO 2,11 — ESCENA: Maltrato / Vosk / Brog y Nima / la dilatación · *(96-106)*,96,ESTÁNDAR,medium; a plate knocked to the floor.,"handheld, dismissive energy.","crew shove past her, ignore her, and a passing hand knocks her food plate to the deck; @StellaPeloCorto watches it scatter, jaw tight.",,9,15:24
ACTO 2,11 — ESCENA: Maltrato / Vosk / Brog y Nima / la dilatación · *(96-106)*,96A,ACCIÓN·insert,"wide, small in the corner of the hold.","static, the crew moving around her.","@StellaPeloCorto folds into a corner of the hold, knees up, watching the strange alien crew move around her — bracing, out of place.",,4,15:28
ACTO 2,11 — ESCENA: Maltrato / Vosk / Brog y Nima / la dilatación · *(96-106)*,97,ESTÁNDAR,"low on @Vosk blocking her path, huge.",push up to his sneer.,"@Vosk — big, scarred — steps into her path and looks her up and down, taunting.",,9,15:37
ACTO 2,11 — ESCENA: Maltrato / Vosk / Brog y Nima / la dilatación · *(96-106)*,98,ACCIÓN,"medium; she slaps his hand away, he grins and swings.",snap-zoom on the first punch.,@StellaPeloCorto smacks his prodding hand aside; @Vosk grins — exactly what he wanted — and throws the first heavy punch.,,7,15:44
ACTO 2,11 — ESCENA: Maltrato / Vosk / Brog y Nima / la dilatación · *(96-106)*,99,ACCIÓN,"dirty brawl, dynamic.",fast handheld in the scuffle.,"@StellaPeloCorto is fast and slippery but small; @Vosk is a wall — he absorbs her hits, shrugs them off, and slams her back against the bulkhead.",,7,15:51
ACTO 2,11 — ESCENA: Maltrato / Vosk / Brog y Nima / la dilatación · *(96-106)*,99A,ACCIÓN·insert,"tight, her ducking and countering.",whip-pans tracking her evasions.,"@StellaPeloCorto ducks two haymakers and lands a quick three-hit combo on @Vosk's ribs — it barely moves him, but her face is pure refusal-to-quit; he wipes his mouth, almost impressed.",,4,15:55
ACTO 2,11 — ESCENA: Maltrato / Vosk / Brog y Nima / la dilatación · *(96-106)*,99B,ACCIÓN·insert,"tight, he hurls her into the lockers.","whip + impact frame, she rolls clear.","@Vosk catches her mid-combo and hurls @StellaPeloCorto into a wall of lockers; she crashes, rolls clear and comes up in a low crouch, breathing hard but unbroken.",,4,15:59
ACTO 2,11 — ESCENA: Maltrato / Vosk / Brog y Nima / la dilatación · *(96-106)*,100,ESTÁNDAR,a giant stone hand enters frame and lifts Vosk away.,settle as Brog plants between them — a frame of weight.,a massive stone hand closes on @Vosk's shoulder and peels him off effortlessly; @Brog — a silent rock giant — plants himself between them and simply stands there.,,9,16:08
ACTO 2,11 — ESCENA: Maltrato / Vosk / Brog y Nima / la dilatación · *(96-106)*,101,ESTÁNDAR,"medium on @Nima, four hands working without looking up.","gentle, settling.","@Nima, four arms busy at once, talks to @StellaPeloCorto without lifting her eyes; @Brog sits down beside the girl in silence.",,9,16:17
ACTO 2,11 — ESCENA: Maltrato / Vosk / Brog y Nima / la dilatación · *(96-106)*,102,ESTÁNDAR,"two-shot, the small girl beside the rock giant.","still, quiet.","@StellaPeloCorto sits against @Brog's vast stone side; he doesn't comfort her, just stays — and she lets out a long breath, the first thread of belonging.",,9,16:26
ACTO 2,11 — ESCENA: Maltrato / Vosk / Brog y Nima / la dilatación · *(96-106)*,103,ESTÁNDAR,"close two-shot, the cruel truth landing.",slow push to her face as it sinks in.,@Theron tells her the worst part flatly; @StellaPeloCorto's face slowly registers the size of it — every day lost here is four lost at home.,,9,16:35
ACTO 2,12 — ESCENA: [AÑO 8] La resistencia / Marek / la encapuchada · *(104-108)*,104,ESTABLISHING,wide establishing of the decaying city.,slow mournful drift over the rot.,"the camera glides over Erdia eight years on — the warm gold gone grey, light-water guttering, machinery and smoke where gardens used to be.",,12,16:47
ACTO 2,12 — ESCENA: [AÑO 8] La resistencia / Marek / la encapuchada · *(104-108)*,104A,ACCIÓN·insert,detail of a thin grey light-water canal; a ragged child crouched.,slow drift to the dimming water.,a once-bright luzagua canal runs thin and grey; a hungry child watches the light gutter — the planet's slow death in one small image.,,4,16:51
