acto,secuencia,clip,tipo,encuadre,camara,accion,dialogo,dur_seg,acumulado
ACTO 3,22 — ESCENA: Stella visita a Naio · *(165-170)*,170,ESTÁNDAR,she promises; he can't bear to tell her the truth about Vera.,"intimate, a shadow of grief on his face.","@StellaTeñida swears to get them all out; @NaioRescatado, no heart to tell her what they believe of Vera, lets her keep her hope.",,9,27:47
ACTO 3,23 — ESCENA: La guerra / rescatan a Naio / la cúpula · *(171-178)*  · **SET-PIECE A6**,171,ACCIÓN,wide as the assault detonates across the streets.,"kinetic, in the chaos.","the resistance assault erupts across the grey fog-streets — naieli surging against imperial robots, the war begins in a storm of energy-light and dust.",,7,27:54
ACTO 3,23 — ESCENA: La guerra / rescatan a Naio / la cúpula · *(171-178)*  · **SET-PIECE A6**,172,ACCIÓN,the crew tearing through robots.,"fast handheld, impact frames.","@Brog smashes breaches through robot lines, @Nima's four arms dismantle units mid-stride, @Noah covers with his light-blade — the found family at war.",,7,28:01
ACTO 3,23 — ESCENA: La guerra / rescatan a Naio / la cúpula · *(171-178)*  · **SET-PIECE A6**,172A,ACCIÓN·insert,"sweeping battle coverage, naieli rising in the ruins.",whip-pans across the front line.,"the camera sweeps the battle — ragged naieli charging imperial robots through the grey ruins, banners and energy-light, the fury of a people who waited twenty years.",,4,28:05
ACTO 3,23 — ESCENA: La guerra / rescatan a Naio / la cúpula · *(171-178)*  · **SET-PIECE A6**,173,ACCIÓN,a commando pulls Naio to safety in the chaos.,"running handheld, dust.","in the chaos a resistance commando hauls @NaioRescatado clear of the fighting, shielding him toward safety.",,7,28:12
ACTO 3,23 — ESCENA: La guerra / rescatan a Naio / la cúpula · *(171-178)*  · **SET-PIECE A6**,174,EMOCIÓN,"primer plano of her looking up at the dome, decision made.","slow push, then a snap up to the palace.","@StellaTeñida looks up at the high dome of the palace and breaks from her recon mission — her face fixed, unstoppable.",,11,28:23
ACTO 3,23 — ESCENA: La guerra / rescatan a Naio / la cúpula · *(171-178)*  · **SET-PIECE A6**,174A,ACCIÓN·insert,she sprints up the rubble and leaps onto the palace wall.,"fast low track, then a vertiginous tilt up as she leaps.","@StellaTeñida sprints up a slope of rubble and launches onto the sheer palace wall, slamming a handhold and starting to climb as the battle rages far beneath her boots.",,4,28:27
ACTO 3,23 — ESCENA: La guerra / rescatan a Naio / la cúpula · *(171-178)*  · **SET-PIECE A6**,175,ACCIÓN,"vertiginous vertical, she climbs under energy-fire.","vertical tracking up the façade, dizzying.","@StellaTeñida scales the towering palace alone, energy-fire shattering the stone at her hands, leaping from ledge to ledge toward the highest dome — tiny against the colossus.",,7,28:34
ACTO 3,23 — ESCENA: La guerra / rescatan a Naio / la cúpula · *(171-178)*  · **SET-PIECE A6**,175A,ACCIÓN·insert,a ledge crumbles; she lunges and catches the dome's rim.,"the camera drops with the falling debris, then snaps up as she catches.","a ledge crumbles under @StellaTeñida; she lunges through open air and barely catches the rim of the glass dome, hanging over the drop, then hauls herself up — face all teeth and will.",,4,28:38
ACTO 3,23 — ESCENA: La guerra / rescatan a Naio / la cúpula · *(171-178)*  · **SET-PIECE A6**,176,ESTÁNDAR,Stella's POV down through the glass at the waiting figure.,"slow, ominous.","through the glass dome @StellaTeñida sees the throne hall far below — and a single white figure standing perfectly still at its heart, as if it knew she would come.",,9,28:47
ACTO 3,23 — ESCENA: La guerra / rescatan a Naio / la cúpula · *(171-178)*  · **SET-PIECE A6**,177,ACCIÓN,she strikes the glass with the Orb; it shatters in slow motion.,impact + slow-mo shards.,@StellaTeñida slams the @Orbe into the glass dome — it shatters into a slow rain of shards — and she drops through into the throne hall.,,7,28:54
ACTO 3,23 — ESCENA: La guerra / rescatan a Naio / la cúpula · *(171-178)*  · **SET-PIECE A6**,177A,ACCIÓN·insert,"extreme detail of the dome shattering, shards spinning in light.",slow-motion through the breaking glass with her.,"the glass dome detonates into a slow-spinning storm of shards lit by the @Orbe's flare; @StellaTeñida plunges through the center of it, glass blooming outward around her like a halo.",,4,28:58
ACTO 3,23 — ESCENA: La guerra / rescatan a Naio / la cúpula · *(171-178)*  · **SET-PIECE A6**,178,ACCIÓN,she lands among falling shards in a crouch.,"impact frame as she lands, shards raining.","@StellaTeñida lands hard in a crouch amid the raining glass and rises, glass glittering around her, eyes fixing on the figure ahead.",,7,29:05
ACTO 3,24 — ESCENA: El trono / el combate emocional / le arrancan el Orbe · *(179-189)*  · **SET-PIECE A7**,179,ESTÁNDAR,wide symmetrical face-off across the hall.,"slow, holding the distance between them.","@StellaTeñida rises to face @SelkaGeneral — the General, 21, white, perfect, cold, grey-blue eyes — two sisters across a throne hall for the first time in twenty years, and neither fully knows it.",,9,29:14
ACTO 3,24 — ESCENA: El trono / el combate emocional / le arrancan el Orbe · *(179-189)*  · **SET-PIECE A7**,180,ACCIÓN,"Selka draws her light-blade, cold.",push to her unblinking face.,"@SelkaGeneral ignites her @HojaSelka, unhurried, contemptuous.",,7,29:21
ACTO 3,24 — ESCENA: El trono / el combate emocional / le arrancan el Orbe · *(179-189)*  · **SET-PIECE A7**,181,ACCIÓN,Stella's open hands; Selka lunges.,snap from Stella's plea to Selka's strike.,"@StellaTeñida holds her hands open, refusing the fight; @SelkaGeneral answers with a lunge of the blade.",,7,29:28
ACTO 3,24 — ESCENA: El trono / el combate emocional / le arrancan el Orbe · *(179-189)*  · **SET-PIECE A7**,181A,ACCIÓN·insert,first blade clash; they lock and spring apart.,"snap-zoom on the clash, sparks.","@SelkaGeneral's @HojaSelka cracks against @StellaTeñida's guard in a shower of sparks; they lock for a heartbeat, faces inches apart, then spring apart — the duel exploding into motion.",,4,29:32
ACTO 3,24 — ESCENA: El trono / el combate emocional / le arrancan el Orbe · *(179-189)*  · **SET-PIECE A7**,182,ACCIÓN,"fast duel; Stella blocks, redirects, disarms her once.","circling whip-pans, the blade flying.","@StellaTeñida blocks, parries and redirects — clearly the stronger — and disarms @SelkaGeneral with a spin, the @HojaSelka skittering away; but she does not strike to kill.",,7,29:39
ACTO 3,24 — ESCENA: El trono / el combate emocional / le arrancan el Orbe · *(179-189)*  · **SET-PIECE A7**,182A,ACCIÓN·insert,a flurry of hand-to-hand after the disarm.,"tight whip-pans, impact frames on each block.","@SelkaGeneral recovers and they trade a blistering hand-to-hand flurry — Stella absorbing, redirecting, never striking to hurt; two identical fighting styles colliding, neither knowing why they mirror each other.",,4,29:43
ACTO 3,24 — ESCENA: El trono / el combate emocional / le arrancan el Orbe · *(179-189)*  · **SET-PIECE A7**,183,ACCIÓN,the question lands; Selka knocks her down.,"push to Stella's face on the line, then impact as she's downed.","@StellaTeñida's question cuts deeper than any blow; in her hesitation @SelkaGeneral knocks her to the floor, blade rising.",,7,29:50
ACTO 3,24 — ESCENA: El trono / el combate emocional / le arrancan el Orbe · *(179-189)*  · **SET-PIECE A7**,183A,ACCIÓN·insert,Selka's takedown; Stella hits the floor hard.,"impact frame as Stella slams down, the blade rising.","@SelkaGeneral sweeps @StellaTeñida's legs and drives her down; Stella hits the marble hard, the wind knocked out of her, @SelkaGeneral's blade already rising over her.",,4,29:54
ACTO 3,24 — ESCENA: El trono / el combate emocional / le arrancan el Orbe · *(179-189)*  · **SET-PIECE A7**,184,EMOCIÓN,"cornered, by reflex Stella cups her palm, a spark of Gix toward Selka's forehead.",the chaos slows to a held breath.,"cornered, by pure reflex @StellaTeñida cups her palm — a spark of @Gix dances in it — and lifts it toward @SelkaGeneral's forehead: the light game from the lab, twenty years buried.",,11,30:05
ACTO 3,24 — ESCENA: El trono / el combate emocional / le arrancan el Orbe · *(179-189)*  · **SET-PIECE A7**,185,ACCIÓN,her blade trembles in the air; she freezes.,slow push to her cracking face.,"@SelkaGeneral freezes mid-strike, the blade shaking — her body remembering the safety of that gesture before her mind can understand why.",,7,30:12
ACTO 3,24 — ESCENA: El trono / el combate emocional / le arrancan el Orbe · *(179-189)*  · **SET-PIECE A7**,186,INSERT,"primerísimo plano sostenido — the General cracks, a child surfacing.","held, foreheads almost touching.","under the General a child surfaces; @SelkaGeneral's grey-blue eyes well, lost, the cold mask splitting.",,6,30:18
ACTO 3,24 — ESCENA: El trono / el combate emocional / le arrancan el Orbe · *(179-189)*  · **SET-PIECE A7**,187,ACCIÓN,"the two still, foreheads close — and that nearness terrifies Selka.","held, then a flicker of panic.",the two are a single heartbeat from waking the sister — and that nearness terrifies @SelkaGeneral more than any blade.,,7,30:25
ACTO 3,24 — ESCENA: El trono / el combate emocional / le arrancan el Orbe · *(179-189)*  · **SET-PIECE A7**,188,ACCIÓN,"terrified, Selka rips the Orb from Stella's hand; Stella collapses.","snap + flare as the Orb tears free, then Stella crumpling.","terrified of her own feeling, @SelkaGeneral grabs Stella's hand and rips the @Orbe out in a blinding flare (only she can — shared blood); @StellaTeñida collapses — coma, not death.",,7,30:32
ACTO 3,24 — ESCENA: El trono / el combate emocional / le arrancan el Orbe · *(179-189)*  · **SET-PIECE A7**,188A,ACCIÓN·insert,the Orb tears free in a blinding flare; Stella's body arcs.,"slow-mo + impact frame on the tear, then a hard whip.","@SelkaGeneral wrenches the @Orbe from @StellaTeñida's palm in a blinding white tear; Stella's body arcs and convulses as the light rips out of her — no blood, only a soul-deep wrench of light leaving a body.",,4,30:36
ACTO 3,24 — ESCENA: El trono / el combate emocional / le arrancan el Orbe · *(179-189)*  · **SET-PIECE A7**,189,ESTÁNDAR,"a spark dives from the bracelet into Stella's chest; Selka, shaking, gives the order.","insert on the spark sinking in, then to Selka's unsteady face.","a spark of @Gix dives from the @Brazalete into @StellaTeñida's chest, clutching her failing heart; @SelkaGeneral stands trembling over her, voice not quite her own.",,9,30:45
ACTO 3,25 — ESCENA: El secreto del palacio (es una nave) · *(190-196)*,190,ESTÁNDAR,"she sets the Orb into the console, expecting the light.","push to her hopeful, brittle face.","@SelkaGeneral carries the @Orbe to the throne console and sets it in place — about to return the light to Erdia, to be the hero she believes she is.",,9,30:54
ACTO 3,25 — ESCENA: El secreto del palacio (es una nave) · *(190-196)*,191,ESTÁNDAR,the wrong silence; her confusion.,"hold, dread building.","nothing happens. The light does not return; @SelkaGeneral's face falters in a wrong, swelling silence.",,9,31:03
ACTO 3,25 — ESCENA: El secreto del palacio (es una nave) · *(190-196)*,192,ACCIÓN,the hall shudders; walls folding into bulkheads.,"shaking, vertiginous.","the whole hall shudders — walls fold into bulkheads, the floor becomes deck, ancient engines waking deep below.",,7,31:10
ACTO 3,25 — ESCENA: El secreto del palacio (es una nave) · *(190-196)*,193,ESTÁNDAR,vast spectacle wide as the whole structure lights up.,sweeping reveal of the scale.,"what everyone believed a palace — what the people believed a meteorite — ignites whole: machinery everywhere, the @NavePalacio rising into itself.",,9,31:19
ACTO 3,25 — ESCENA: El secreto del palacio (es una nave) · *(190-196)*,194,ESTÁNDAR,Selka small against the rising machinery.,tilt up the awakening structure.,"the structure climbs around @SelkaGeneral — it was always a ship, every column a strut, every wall a bulkhead.",,9,31:28
ACTO 3,25 — ESCENA: El secreto del palacio (es una nave) · *(190-196)*,195,ESTÁNDAR,Selka backs toward the throne; a voice answers from it.,"push to her fear, then to the shadowed throne.","@SelkaGeneral backs away, afraid for the first time in her life; from the throne a laugh answers in a thousand voices.",,9,31:37
ACTO 3,25 — ESCENA: El secreto del palacio (es una nave) · *(190-196)*,196,EMOCIÓN,the King rises from the throne; the hall holds its breath.,slow ominous push to Vorthan rising.,"@Vorthan rises from the throne, unhurried; @StellaTeñida lies dying nearby, @SelkaGeneral frozen — the moment before everything is revealed.",,11,31:48
ACTO 3,"26 — ESCENA: ""Fui yo"" (la revelación) 🔒 · *(197-207)*",197,ESTÁNDAR,Vorthan's form shifts and resolves into Vera.,"slow, unnerving push as the change completes.","@Vorthan begins to change — his form flowing — and settles into the shape of @VeraEncapuchada, the mother's face, grey-blue eyes.",,9,31:57
ACTO 3,"26 — ESCENA: ""Fui yo"" (la revelación) 🔒 · *(197-207)*",198,EMOCIÓN,"the mother's face kneels by the dying daughter, strokes her hair.","slow, tender, monstrous.","wearing the mother's face, the thing kneels beside the dying @StellaTeñida and strokes her dark-dyed hair — sweet and monstrous at once.",,11,32:08
ACTO 3,"26 — ESCENA: ""Fui yo"" (la revelación) 🔒 · *(197-207)*",199,INSERT,primerísimo plano — she opens her eyes and sees only her mother.,"held, soft.",@StellaTeñida half-opens her eyes one last time — and does not see the monster; she sees her mother.,,6,32:14
ACTO 3,"26 — ESCENA: ""Fui yo"" (la revelación) 🔒 · *(197-207)*",200,ESTÁNDAR,her smile; she closes her eyes and goes.,"slow, holding her face.","@StellaTeñida smiles, believing her mother came for her, and slips away in peace; the false Vera watches her go.",,9,32:23
ACTO 3,"26 — ESCENA: ""Fui yo"" (la revelación) 🔒 · *(197-207)*",201,ESTÁNDAR,the form rises and becomes Marek; Selka watches in horror.,slow reveal of the second face.,"the thing rises and takes a second form — @Marek, the resistance's beloved leader — and @SelkaGeneral watches the people's hero step out of her King.",,9,32:32
ACTO 3,"26 — ESCENA: ""Fui yo"" (la revelación) 🔒 · *(197-207)*",202,ESTÁNDAR,Marek's smile delivering the truth.,slow push to the smiling face.,"wearing Marek's face, the thing explains how every blow against the resistance always landed.",,9,32:41
ACTO 3,"26 — ESCENA: ""Fui yo"" (la revelación) 🔒 · *(197-207)*",203,ESTÁNDAR,the form shrinks into a small white-haired child and turns to the General.,"slow, uncanny push.","the thing shrinks into a small child — @SelkaNiña, white hair, grey-blue eyes — and turns that little face toward the General.",,9,32:50
ACTO 3,"26 — ESCENA: ""Fui yo"" (la revelación) 🔒 · *(197-207)*",204,EMOCIÓN,the child speaks the verdict; the General breaks.,intercut child-face / the General shattering.,with that tender little face the thing tells @SelkaGeneral the truth that unmakes her.,,11,33:01
ACTO 3,"26 — ESCENA: ""Fui yo"" (la revelación) 🔒 · *(197-207)*",205,EMOCIÓN,"primerísimo plano — she hums the lullaby, understands, breaks.","held, devastating.",@SelkaGeneral starts to hum the lullaby without meaning to — and finally understands it: her mother's song; she shatters completely.,,11,33:12
ACTO 3,"26 — ESCENA: ""Fui yo"" (la revelación) 🔒 · *(197-207)*",206,ESTÁNDAR,Selka's eyes find her fallen sister.,slow push from Selka to Stella's still form.,"@SelkaGeneral's eyes drop to @StellaTeñida, still on the floor — the sister who crossed a universe for her, whom she just struck down without knowing.",,9,33:21
ACTO 3,"26 — ESCENA: ""Fui yo"" (la revelación) 🔒 · *(197-207)*",207,ESTÁNDAR,"the child-face laughing, beginning to swell.",push as the small form starts to grow.,"the child-thing laughs, and its small shape begins to swell and distort — the disguise ending, the true horror rising.",,9,33:30
ACTO 3,27 — ESCENA: El Parásito / el brazo de Selka / Theron / la extracción · *(208-216)*  · **SET-PIECE A8**,208,ACCIÓN,contrapicado extremo as the colossal creature unfolds.,"tilt up, unable to contain it; the hall shaking.","the disguises fall and the @Parasito takes its true form — a colossal ancient creature of stolen light, filling the throne hall, the structure trembling around it.",,7,33:37
ACTO 3,27 — ESCENA: El Parásito / el brazo de Selka / Theron / la extracción · *(208-216)*  · **SET-PIECE A8**,208A,ACCIÓN·insert,the creature lashes; Selka tiny beneath it.,"vertiginous, debris flying.","the @Parasito lashes out, columns of light and debris exploding across the hall; @SelkaGeneral is a speck beneath the thing that emptied her whole world.",,4,33:41
ACTO 3,27 — ESCENA: El Parásito / el brazo de Selka / Theron / la extracción · *(208-216)*  · **SET-PIECE A8**,209,ACCIÓN,"newly human again, she charges the colossus.","handheld running with her, the monster filling frame.","newly broken and human again, @SelkaGeneral takes up her @HojaSelka and hurls herself at the @Parasito to cover Stella's rescue — fury and grief fused on her face.",,7,33:48
ACTO 3,27 — ESCENA: El Parásito / el brazo de Selka / Theron / la extracción · *(208-216)*  · **SET-PIECE A8**,209A,ACCIÓN·insert,she weaves the colossal limbs as she charges in.,"vertiginous, the giant's strikes filling frame.","@SelkaGeneral charges the @Parasito, ducking and rolling under colossal sweeps of light that crater the floor around her, closing the distance with reckless fury, her @HojaSelka raised.",,4,33:52
ACTO 3,27 — ESCENA: El Parásito / el brazo de Selka / Theron / la extracción · *(208-216)*  · **SET-PIECE A8**,210,ACCIÓN,a sweep of light severs her arm; she falls.,"impact frame + the camera dropping with her. Cauterized by light, no blood.","the @Parasito, almost without noticing, severs @SelkaGeneral's arm with a sweep of light (cauterized, no blood); she crashes down, maimed but alive — her face: pain, and beneath it, relief at the seconds she bought.",,7,33:59
ACTO 3,27 — ESCENA: El Parásito / el brazo de Selka / Theron / la extracción · *(208-216)*  · **SET-PIECE A8**,210A,ACCIÓN·insert,detail of the cauterized stump glowing; she crashes down.,"the camera drops with her, impact frame. Cauterized by light, no blood.","@SelkaGeneral crashes to the floor, the stump of her arm cauterized to a glowing seal (no blood); her face twists in pain and then, beneath it, fierce relief — she bought the seconds.",,4,34:03
ACTO 3,27 — ESCENA: El Parásito / el brazo de Selka / Theron / la extracción · *(208-216)*  · **SET-PIECE A8**,211,ACCIÓN,"a bulkhead explodes; Theron enters, low-angle heroic.",push to his face seeing his prey at last.,"a bulkhead blows inward and @Theron strides in — and sees the creature with his own eyes; twenty thousand years, and his prey finally has a face.",,7,34:10
ACTO 3,27 — ESCENA: El Parásito / el brazo de Selka / Theron / la extracción · *(208-216)*  · **SET-PIECE A8**,212,ACCIÓN,"man-versus-colossus, Theron buying seconds.","speed-ramped, brutal exchanges.","@Theron throws himself at the @Parasito, weaving its colossal strikes, holding the line to buy the others time — a single hunter against a mountain of light.",,7,34:17
ACTO 3,27 — ESCENA: El Parásito / el brazo de Selka / Theron / la extracción · *(208-216)*  · **SET-PIECE A8**,213,ACCIÓN,the two pour through the breach toward the fallen.,"fast handheld, dust and light.","@Brog and @Nima charge in through the breach while @Theron holds the monster, racing for the two fallen sisters.",,7,34:24
ACTO 3,27 — ESCENA: El Parásito / el brazo de Selka / Theron / la extracción · *(208-216)*  · **SET-PIECE A8**,214,ACCIÓN,Brog lifts Stella; Nima carries Selka; Vosk covers the door.,running handheld of the extraction.,@Brog scoops @StellaTeñida (in coma) like a feather; @Nima carries the maimed @SelkaGeneral; @Vosk covers them from the doorway — he made it after all.,,7,34:31
ACTO 3,27 — ESCENA: El Parásito / el brazo de Selka / Theron / la extracción · *(208-216)*  · **SET-PIECE A8**,215,ACCIÓN,"Nima yells; Theron retreats backward, eyes on the monster.",whip between Nima and the retreating Theron.,"@Nima screams for the exit; @Theron backs away from the @Parasito, never taking his eyes off it, the hall collapsing into light.",,7,34:38
ACTO 3,27 — ESCENA: El Parásito / el brazo de Selka / Theron / la extracción · *(208-216)*  · **SET-PIECE A8**,215A,ACCIÓN·insert,the hall collapses around them as they flee.,"running handheld, debris and light raining.","the throne hall caves in around @Brog, @Nima, @Vosk and the two fallen sisters as they run for the breach, columns of light and falling debris exploding behind them, the @Parasito's roar shaking everything.",,4,34:42
ACTO 3,27 — ESCENA: El Parásito / el brazo de Selka / Theron / la extracción · *(208-216)*  · **SET-PIECE A8**,216,ACCIÓN,the group bursts out toward the open sky.,fast forward track out of the collapsing hall.,"the group breaks out of the collapsing throne hall toward the grey sky, the @Parasito's roar shaking the structure behind them.",,7,34:49
ACTO 3,28 — ESCENA: La huida del monstruo · *(217-221)*,217,ACCIÓN,the palace tears free of the city and rises.,"crane up with the colossal ship, debris raining.","the @NavePalacio tears free of the city, scattering debris, the @Orbe blazing in its core, and climbs into the sky over Erdia.",,7,34:56
ACTO 3,28 — ESCENA: La huida del monstruo · *(217-221)*,218,EMOCIÓN,vast wide of the colossal ship dwarfing the ruined city.,slow awe-struck tilt up.,"the @NavePalacio ascends over the broken city, impossibly vast, dwarfing everything below.",,11,35:07
ACTO 3,28 — ESCENA: La huida del monstruo · *(217-221)*,219,ACCIÓN,a slash of light opens in the sky ahead of the ship.,push toward the opening portal.,"the @NavePalacio opens a portal in the sky — a slash of light toward elsewhere, toward the next world it will empty.",,7,35:14
ACTO 3,28 — ESCENA: La huida del monstruo · *(217-221)*,220,ESTÁNDAR,the ship enters the portal; the sky closes.,"hold as it vanishes, then quiet.","the @Parasito does not pursue Stella or Theron — it has what it came for; the @NavePalacio slides into the portal and vanishes, and the sky closes.",,9,35:23
ACTO 3,28 — ESCENA: La huida del monstruo · *(217-221)*,221,ESTÁNDAR,Theron watching the empty sky where the portal was.,"slow push, for once not lost.","on the bridge @Theron stares at the spot where the portal was — for the first time in twenty thousand years, he is not lost.",,9,35:32
ACTO 3,29 — ESCENA: Cierre · *(222-228)*,222,EMOCIÓN,"Stella floating asleep in a life-support tank, Naio beside it.","slow, mournful, quiet.","in the infirmary @StellaTeñida floats asleep in a @TanqueSoporte, in a coma; @NaioRescatado sits beside the glass, unable to reach her.",,11,35:43
ACTO 3,29 — ESCENA: Cierre · *(222-228)*,223,EMOCIÓN,"primerísimo plano of a faint ember glow over her heart, inside the water.",micro push to the dimming ember.,"over @StellaTeñida's heart, inside the tank, a faint glow pulses — like an ember about to go out: @Gix, still inside, still holding her heart.",,11,35:54
ACTO 3,29 — ESCENA: Cierre · *(222-228)*,224,EMOCIÓN,"Theron looking at the ember, grim.",slow push to the tank.,@Theron looks at the failing ember and says the quiet truth.,,11,36:05
ACTO 3,29 — ESCENA: Cierre · *(222-228)*,225,ESTÁNDAR,"Selka enters, one arm gone, bandaged, hollowed.","slow, holding her ruin.","@SelkaGeneral enters, one arm gone and bandaged, the face of someone who lost everything in a single night and doesn't yet know how to breathe with it.",,9,36:14
ACTO 3,29 — ESCENA: Cierre · *(222-228)*,226,ESTÁNDAR,she takes Naio's hand with her remaining one.,intimate two-shot.,"@SelkaGeneral goes to @NaioRescatado and takes his hand with her one remaining hand, swearing the oath that makes her the protagonist of what comes next.",,9,36:23
ACTO 3,29 — ESCENA: Cierre · *(222-228)*,227,ESTÁNDAR,her palm flat on the cold glass over her sleeping sister's face.,slow push to her hand and her sister's face through the glass.,"@SelkaGeneral presses her one palm to the cold glass of the @TanqueSoporte, over @StellaTeñida's sleeping face, and speaks to her.",,9,36:32
ACTO 3,29 — ESCENA: Cierre · *(222-228)*,228,EMOCIÓN,"insert on the ember; it pulses once more, faint but alive; cut to black.","micro hold on the ember, then to black.","inside the tank the ember of @Gix pulses once more — faint, but it pulses; cut to black. Title: EL NODO DE ERDIA.",,11,36:43
